2008/9/18,b'Russia may sell more air defense systems to Iran'
2008/9/18,b'Russian President Threatens Arctic Annexation'
2008/9/18,b'China accuses US of financial Weapon of Mass Destruction'
2008/9/18,b'Terror on the high seas: the brutal return of piracy'
2008/9/18,"b'Israel Takes Step Toward Electing Woman PM, Foreign Minister Tzipi Livni Wins Kadima Party Primary; In Good Position To Become First Female Leader In 34 Years'"
2008/9/18,"b""Bush: U.S. Embassy attack a reminder nation 'at war'.  Does anybody still listen to this guy?"""
2008/9/18,"b'China Blames US for Tainted Dairy Products, 100 children Sick'"
2008/9/18,"b'In a world first, women in the majority in Rwanda legislature'"
2008/9/18,b'Blogger Posts Malaysian Flag Upside Down; Arrested For Sedition'
2008/9/18,b'How the economy tanked for dummies'
2008/9/18,"b'Iraqis kills 3 contractors, city Fallujah is razed. U.S. soldier kills 4 bounded Iraqs, gets 7 months.'"
2008/9/18,b'CIA Chief Speaks of Trying to Provoke Terrorists as Latest Drone Strike Kills Seven in South Waziristan'
2008/9/18,"b'German Authorities Wiretap Skype, Raid Homes of Whistleblowers.'"
2008/9/18,"b'In Yemen, a Planned Massacre of Americans Is Averted'"
2008/9/18,b'Livni sweeps Kadima race; Olmert pledges cooperation '
2008/9/18,b'Rising prices tip another 75 million towards starvation'
2008/9/18,"b""Sri Lanka's navy says it has fought a sea battle with Tamil rebels, a day after what the military described as the heaviest day of fighting in weeks."""
2008/9/18,b'official poverty rates of 51.8% in Gaza and 19.1% in the West Bank soar to 79.4% and 45.7%'
2008/9/18,b'India deploys planes with Nuclear Capability in Kashmir '
2008/9/18,b'Tariq Ali: Has the U.S. Invasion of Pakistan Begun?'
2008/9/19,b'Brits take a stand - ban short-selling of financial stocks'
2008/9/19,b'Scientology could be banned in France if they lose fraud lawsuit. '
2008/9/19,"b""Spain's media in uproar over McCain's comments regarding Prime Minister Zapatero"""
2008/9/19,"b""Arabs across the ideological spectrum are denouncing cleric's fatwa on 'immoral' TV"""
2008/9/19,b' Bitter Asians wag the finger at U.S. bank bailouts'
2008/9/19,"b""Rome's Ban On Skimpy Clothing Leads Prostitutes To Dress As Nuns"""
2008/9/19,"b""UCLA study of satellite imagery casts doubt on surge's success in Baghdad"""
2008/9/19,b'China Blames Wall Street Meltdown On Federal Reserve Overissuance Of Currency '
2008/9/19,b'Unknown piece of music by Mozart found in France'
2008/9/19,b'Interesting Places: Shibam: Manhattan of the Desert [pics]'
2008/9/19,b'UK Teenager sentenced to jail for two years for downloading a guide to making naplam'
2008/9/19,"b'Why are people worried about short selling (Alex, financial cartoon)'"
2008/9/19,b'US air raid kills Iraq civilians'
2008/9/19,b'Russian minister says war with the United States not possible'
2008/9/19,b'North Korea Preparing to Restart Nuclear Facility'
2008/9/19,b'America continues to lose world influence as Russia sells weapons to Iran and  Venezuela'
2008/9/19,b'Rice says U.S. will resist Russian moves against its neighbors'
2008/9/19,b'14 men rob a coca cola factory - shoot out with security - wtf!! '
2008/9/19,"b'South Ossetia information warfare, two sides presented in one talk show'"
2008/9/19,b'North Korea preparing to restart nuclear reactor'
2008/9/19,b' Venezuela expels U.S. rights group for criticism'
2008/9/19,b'Chavez expells Human Rights Watch from Venezuela for criticizing govt.'
2008/9/19,b'Euthanasia advocate takes her own life.'
2008/9/19,"b""The complete list of the world's billionaires"""
2008/9/19,"b""Swaziland's HIV/AIDS treatment crisis goes critical"""
2008/9/20,b'On This Day: Witold Pilecki Allows Himself to be Captured by the Nazis'
2008/9/20,b'While claiming to be non-partisan and not for profit MEMRI uses US tax payer money to mistranslate Arab news media to further a pro-Israel agenda'
2008/9/20,b'Suicide bomb explodes outside Islamabad hotel  - many dead'
2008/9/20,b'Protest turns violent as thousands of Germans take to the streets to counter anti-Islamic right-wing demonstration'
2008/9/20,"b""Pakistan in sovereignty warning: Pakistani President Asif said he will not allow Pakistan's territory to be violated by terrorists or foreign powers fighting th"""
2008/9/20,"b'Why is a massive terrorist attack on Pakistan, blasting a huge crater in the earth and rocking buildings up to two miles away, *not* the biggest story on reddit?'"
2008/9/20,b'Breaking News: South African President Mbeki to quit'
2008/9/20,"b'Russia, France put aside Georgia war differences. The US Snarls.'"
2008/9/20,"b""India's moon mission unveiled"""
2008/9/20,"b'Repression of religious freedom in some parts of China has intensified over the past year, the US government says.'"
2008/9/20,b'Deadly blast targets Marriott Hotel in Islamabad'
2008/9/20,"b""China's tainted milk scandal has worsened, with tests now showing liquid milk is also affected"""
2008/9/20,b'Three year cover up in China milk scandal '
2008/9/20,b'How the woman set to be Israels new Prime Minister was an agent  in an elite spy unit'
2008/9/20,"b' A ""terrorist"" being questioned'"
2008/9/20,b'Apocalypse Now?: New world order could have devastating implications for Western nations'
2008/9/20,b'Pakistan Warns Against Violation of Sovereignty'
2008/9/20,b'Russia to build space launch site in Cuba'
2008/9/20,"b""Bill Maher Video Replaces Top Iraqi Ayatollah's Website In Hacking Stunt [video]"""
2008/9/20,"b""(UK) Man Praises Qur'an, Stabs Woman in Head with Screwdriver"""
2008/9/20,b'Hadron Collider forced to halt '
2008/9/20,"b'Bomb Explodes at Hotel in Pakistans Capital, Killing at Least 40'"
2008/9/20,b'Mexico plans anti-kidnap police'
2008/9/20,b'Big bailout: Where things stand '
2008/9/20,b'A Closer Look at Recent Violence in Bolivia'
2008/9/21,"b'US marines were seen transporting metal crates inside the Marriot Hotel the day before, security personnel was not allowed to know for what purpose'"
2008/9/21,"b""Czech Republic's ambassador is among those killed in Pakistan Marriot Hotel attack"""
2008/9/21,b'Quebec Man Changes Name To Avoid No-Fly List'
2008/9/21,"b'For the past month, the risk of a war between the United States and Pakistan has quietly grown.'"
2008/9/21,b'Israel troops kill 14yo near settlement '
2008/9/21,"b'The U.S. Army has just awarded a $4 million contract to begin developing ""thought helmets"" that would harness silent brain waves for secure communication among troops.'"
2008/9/21,"b'Massive suicide bombing at Mariott hotel in Islamabad, Pakistan. They used a bomb filled truck and rammed it into the building. '"
2008/9/21,"b'Church of England admits ""by getting our first reaction (to Darwin\'s Theory of Evolution) wrong, encouraging others to misunderstand still.""'"
2008/9/21,b'Explosion in Pakistan causes 33 foot deep crater'
2008/9/21,b'Terror chief tipped to head MI6'
2008/9/21,b'UK Police Federation set to demand right to strike'
2008/9/21,"b'15 killed, 30 injured attempting to steal fuel from train in India '"
2008/9/21,b'Chavez says Latin America needs Russia'
2008/9/21,b'South African President Mbeki formally resigns'
2008/9/21,b'Warning in Israel &amp; Palestine:  We must be ready to use force against Hamas to take control of Gaza'
2008/9/21,"b""Could this be the world's largest diamond? Huge uncut gem discovered in African mine"""
2008/9/21,b'Israeli PM Olmert declares intent to resign - CNN.com'
2008/9/21,b' Scandal-hit Olmert to resign formally Sunday'
2008/9/21,b'REPOSSESSED? Millionaire spooked from mansion'
2008/9/21,b' Rescuers comb Pakistan bomb hotel'
2008/9/21,b'Diplomats: Syria passes 1st test of nuclear probe'
2008/9/21,b'Man lives for ten months without cash'
2008/9/21,b'Explosion At Pakistan Marriott Hotel Kills at least 40.'
2008/9/21,b'Ebay warning ahead of All-Ireland'
2008/9/21,b'Pakistani president tells foreign troops to keep out'
2008/9/22,b'Russian navy sails to Venezuela '
2008/9/22,b'Oil prices shoot up over $25 a barrel - the biggest 1-day rise ever - as anxiety over US bailout weighs on dollar '
2008/9/22,"b'Russia has successfully fired a new intercontinental ballistic missile. The Bulava missile has a range of 10,000 kilometers and can carry six individually targeted nuclear warheads.'"
2008/9/22,"b""Pakistan's top leaders were to have been in the Islamabad Marriott hotel when it was bombed - but changed venue at the last minute"""
2008/9/22,"b""After a 20 year ban, Italy's Prime Minister has vowed to return nuclear power to the country"""
2008/9/22,"b'Nearly 53,000 Chinese children sick from milk - Yahoo! News'"
2008/9/22,"b'""Mariam Ayyad, 57, attempted to block Israeli soldiers from arresting university students in her building ... was beaten and pushed and she fell down the stairs.""'"
2008/9/22,b'Sex with trafficked women to be criminalised'
2008/9/22,"b'That Syrian ""Nuclear Facility"" that Israel bombed last year?  The IAEA found no trace of radiation nor graphite in the remains.'"
2008/9/22,"b""Another 'W'  Foreign Policy Failure - Russia and Venezuela to Conduct Joint Naval Excercises in Caribbean """
2008/9/22,"b'Iraqi Lawmaker Faces Prosecution For Visiting Israel, Advocating Peace'"
2008/9/22,b'Pakistani troops fire on invading U.S. choppers'
2008/9/22,"b""Pakistan troops 'repel US raid'"""
2008/9/22,"b'Breaking: Pakistani Troops, Tribesmen Fire On US Helicopters'"
2008/9/22,b'Pakistani forces fire at US choppers: officials. The incident happened late on Sunday near Lwara Mundi village in the North Waziristan district'
2008/9/22,"b""All We are Saying is GIve Peace a Chance - UN: 'Guns Fall Silent' in Afghanistan on Peace Day"""
2008/9/22,b'Dig pinpoints Stonehenge origins'
2008/9/22,"b'Almost 13,000 Chinese children sickened by tainted milk '"
2008/9/22,"b""Pakistan's rulers were supposed to be in Hotele during bomb attack """
2008/9/22,"b'Turkey scared to admit Armenian genocide, says historian'"
2008/9/22,"b""Change in dinner plans saved Pakistan's rulers from hotel bomb attack"""
2008/9/22,b'Pakistani troops fire on intruding U.S. choppers'
2008/9/22,b'Heads are starting to role in China as the tainted diary products scandal deepens. '
2008/9/22,b'Russian ambassador: Czechs selling security for radar'
2008/9/22,"b""Merchant of Death appears in Thai court, no it's not Nic Cage"""
2008/9/23,"b'$US 13 billion of the money allocated for reconstruction projects in Iraq was wasted or stolen, with some of it ending up in al-Qaedas coffers'"
2008/9/23,"b""[Breaking] 'Shooting' at school in Finland"""
2008/9/23,b'Noida CEO beaten to death by sacked employees'
2008/9/23,"b""Japan starts work on $9B 'space elevator' to replace rockets """
2008/9/23,b'Venezuela Welcomes Russian Warships and Chinese Fighter Jets'
2008/9/23,b'Scenes from India (pics)'
2008/9/23,"b""Methane 'escaping' from Arctic sea bed"""
2008/9/23,"b""22 year old story, submitted as news, reaches reddit's front page."""
2008/9/23,"b"" 'Grim' Afghanistan Report To Be Kept Secret by US """
2008/9/23,b'Colin Powell On Russia/Georgia Conflict: Georgia Started It'
2008/9/23,b'School shooting in finland'
2008/9/23,"b'Millions of tonnes of methane, bubbling to surface of Arctic sea, could accelerate global warming'"
2008/9/23,b'Critics Question Ability Of Missile Defense System'
2008/9/23,"b""Iran president blames Wall Street turmoil on U.S. 'military engagement'"""
2008/9/23,b'Irans President Mahmoud Ahmadinejad says the US military intervention abroad is partly to blame for the economic turmoil on Wall Street.'
2008/9/23,b'Sarkozy calls for those behind the market crisis to be punished'
2008/9/23,"b""Russia engages in 'gangland' diplomacy as it sends warship to the Caribbean"""
2008/9/23,"b""EU patent office on strike: 'the organisation is decentralising and focusing on granting as many patents as possible to gain financially from fees generated.'"""
2008/9/23,b'Mystery surrounds hijacked Iranian ship'
2008/9/23,b' U.S.-led wars behind Wall Street crisis: Ahmadinejad'
2008/9/23,b'Pakistan blames US raids for hotel bombing'
2008/9/23,b'Double Darwin Award? A couple having sex on a railway track have been killed by a train'
2008/9/23,b'Tourists Taken Hostage in Egypt - Relocated to Sudan'
2008/9/23,"b'Bush, Ahmadinejad To Speak At UN '"
2008/9/23,b'Workers Allegedly Beat CEO To Death In India'
2008/9/24,"b""Iran leader says 'American empire' near collapse"""
2008/9/24,"b'Global corruption index: Somalia most, Denmark least corrupt country'"
2008/9/24,"b""All Systems Go for China's Manned Space Launch"""
2008/9/24,"b'The wreckage of a suspected US spy plane has been found near the Afghan border by the Pakistani army, but it has denied claims it was shot down'"
2008/9/24,"b'Children are targets of Nigerian witch hunt | Children and babies branded as evil are being abused, abandoned and even murdered while the (Christian Evangelical) preachers make money out of the fear'"
2008/9/24,"b""N Korea nuclear seals 'removed' """
2008/9/24,b'North Korea expels IAEA monitors from atom bomb plant'
2008/9/24,"b""Amid milk scare, China's elite get special food"""
2008/9/24,b'Aid groups: Tony Blair faces imminent failure in Middle East '
2008/9/24,"b""Iran's Ahmadinejad: US 'empire' nears collapse"""
2008/9/24,b'Pakistanis shoot down suspected U.S. military drone'
2008/9/24,b'English Tutor flees the country after swindling 5 billion.'
2008/9/24,b'.S. navy tanker under apparent pirate attack off Somalia '
2008/9/24,b'Hurricanes Shift Debate On Embargo Against Cuba '
2008/9/24,b'Soldiers accidentally kill Sunni leader in Iraq'
2008/9/24,b'Astronomers detect an interplanetary collision. Worldnews?'
2008/9/24,"b'Fears grow in Lebanon as 10,000 Syrian troops arrive on the border'"
2008/9/24,b'They further stated that from here on the IAEA inspectors will have no further access to the reprocessing plant.'
2008/9/24,b'Admiral Mullen Pleads For Co-operation With Russia'
2008/9/24,b'Russia Refuses To Meet With U.S. on Iranian Nuclear Program'
2008/9/24,"b'Krugman on the bailout: All the signs I look at, declared Paulson in April 2007, show the housing market is at or near a bottom. Umm, yeah, and we should trust your judgment now?'"
2008/9/24,"b'Pittsburgh students cannot get less than 50% in assignments, tests and other work.'"
2008/9/24,b'Four fallacies about the Russo-Georgian conflict'
2008/9/24,"b""Georgia's president announces government overhaul"""
2008/9/24,b'Does the Cold War Have Lessons for Today?'
2008/9/25,b'Russian woman caught red-handed drinking orange juice in Dubai'
2008/9/25,b'Russia to loan Chavez $US 1 billion  to buy arms'
2008/9/25,"b'Henry Rollins in Israel. ""Your kids will inherit the war you did not stop."" Amazing video.'"
2008/9/25,"b'Stopping a Financial Crisis, the Swedish Way'"
2008/9/25,b'Pakistani troops fire at US helicopters on border'
2008/9/25,"b""Ahmadinejad: 'American Empire' Nearing its End"""
2008/9/25,"b'Internet will run out of IP addresses by 2010, warns Vint Cerf'"
2008/9/25,"b""Pakistan 'fires on Nato aircraft' """
2008/9/25,"b""Zardari Says U.S. Raids Harm Pakistan's Anti-Extremist Campaign  """
2008/9/25,b' US finds emboldened Russia holding the cards'
2008/9/25,b'Venezuela: Enchilada of Evil'
2008/9/25,"b'Green Knives Bide Their Time For Gordon Brown : Red, Green, and Blue'"
2008/9/25,"b'N.Korea ousts U.N. monitors, to restart atom bomb plant '"
2008/9/25,"b'Iraq passes election laws that US and Iraq officials call ""crucial"" for the nation to heal its political and religious fissures.'"
2008/9/25,b'Fred Reed throws his hat in the presidential ring'
2008/9/25,b'Senior White House officials were central in discussions on using harsh interrogation techniques'
2008/9/25,b'Shots fired in US-Pakistan clash'
2008/9/25,b'The suspense is killing me'
2008/9/25,b'Carla Bruni-Sarkozy in New York  '
2008/9/25,"b'A McCain-Palin ad claims Obama has been ""mum"" on the economic crisis. That\'s false.'"
2008/9/25,b'Finnish gunman burnt bodies after massacre'
2008/9/25,b'Bistros going out of business as French diners stay home or turn to fast food'
2008/9/25,"b""Venezuela's Chavez sees America as a 'sinking ship'"""
2008/9/25,b'Indonesia cleaning up corruption'
2008/9/25,b'Do you drink enough water? '
2008/9/26,"b'Japanese space tourist paid Space Adventures $21M to go to the ISS. They bumped him, sent one of their investors instead, and kept his money'"
2008/9/26,"b""France's top diplomat said Thursday that many European nations have decided to wait out the Bush administration"""
2008/9/26,b'Xinhua Runs Spacewalk Story Before Astronauts Leave Earth'
2008/9/26,"b""Somali pirates 'seize 30 tanks'...where are the ninjas when you need them?"""
2008/9/26,"b""New Coup D'Etat Rumblings in Venezuela"""
2008/9/26,b'The Swedish government says it is proposing measures to soften an eavesdropping law after widespread public protests'
2008/9/26,"b""Pakistan 'kills 1,000 militants'"""
2008/9/26,b'BBCNews: US military says its troops have exchanged gunfire with Pakistani forces across the border with Afghanistan. '
2008/9/26,"b""1st anniversary of Burma's bloody Saffron Revolution"""
2008/9/26,b'Jewish extremists suspected in attack on Israeli peace activist'
2008/9/26,b'BBC: World leaders and philanthropists pledge nearly $3 billion to fight malaria'
2008/9/26,b'Gay leader assassinated in Baghdad. Militia run Islamic courts sentencing gays to death.'
2008/9/26,"b'90 School Children Abducted by Uganda Rebel, LRA'"
2008/9/26,"b""Over half of Europe's amphibians face extinction by 2050 | Environment | The Guardian"""
2008/9/26,"b""Carbon dioxide emissions in '07 outpaced researchers' most dire projections"""
2008/9/26,b'Pakistani and American Troops Exchange Fire'
2008/9/26,b'Iran Sinking as Groundwater Resources Disappear'
2008/9/26,b'Russia to ban Simpsons and South Park'
2008/9/26,b'Tehran - A tale of two cities?'
2008/9/26,b'2 Terrorism Suspects Arrested on KLM Flight'
2008/9/26,b'Fusionman crosses the English Channel using his jet wing! [article and vid]'
2008/9/26,"b'Pakistan warned US troops not to intrude on its territory Friday, after the two anti-terror allies traded fire along the volatile border with Afghanistan'"
2008/9/26,"b""China's astronauts in orbit, prepare for spacewalk"""
2008/9/26,b'Government questionnaires stir unease about ethnic cleansing in a Baghdad enclave'
2008/9/26,b'Harper Hunt'
2008/9/27,b'Venezuela and China Sign a New Oil Deal'
2008/9/27,"b'India: 13 year-old boy attempts to return a bag. The bag was the bomb. Terror strikes Delhi again, on Saturday.'"
2008/9/27,"b""Iraqi progress: Baghdad's best medical facility cannot even keep their elevators operating"""
2008/9/27,b'Democracy Now: Ahmadinejad Interview Part 1'
2008/9/27,"b""IAEA's Syrian Contact Assassinated, Stalling Nuclear Probe"""
2008/9/27,b'Canadian Pol Dumps Candidate Over 9/11 Remarks '
2008/9/27,b'End of road for driver with $1.9 million in fines'
2008/9/27,"b'China, Pakistan to further enhance military ties'"
2008/9/27,"b""International Criminal Court's chief prosecutor will continue to push for Sudan's leader to be charged with war crimes"""
2008/9/27,"b'the attack Thursday evening on the Faina, a Ukrainian vessel bringing military equipment to Kenya, has provoked the wrath of two of the most powerful militaries on the planet'"
2008/9/27,b'Russia Aims to Upgrade Nuclear Arsenal'
2008/9/27,b'Finnish ISP thinks W3C.org is a child-porn site'
2008/9/27,b'Global Warming Pollution Increases 3 Percent: Chinese Greenhouse Gas Pollution Largely Responsible for Bringing CO2 Emissions to Record High'
2008/9/27,"b""'Holy' Airliner Hijacking Thwarted in the Netherlands"""
2008/9/27,b'Director of a British company who bribed a Ugandan official escapes jail | World news | The Guardian'
2008/9/27,b'Sir Alex Fergusan: Berbatov can bring us the title'
2008/9/27,"b'Iraq Signs Billion Dollar Power Deals with GE, Siemens'"
2008/9/27,b'NKorea may already have nuclear warheads: ex-CIA official'
2008/9/27,b'Paul Newman Dead'
2008/9/27,"b""Zimbabwe's food crisis is escalating"""
2008/9/27,b'Bush says bail-out will be passed'
2008/9/27,b'British Army Demands the Right to be British: Race Gestapo Upset '
2008/9/27,"b""From 'straight talk' to smear campaign... The Straight Talk Express has taken a nasty turn into the gutter"""
2008/9/27,b'Pictured: How China gets its troops to stand to attention - pins in their collars and crosses on their backs'
2008/9/27,"b""In other elections ... honestly I didn't know whether to put this in the  World News, Funny or WTF reddit"""
2008/9/28,b'Muslim said he is suing Supermarket giant Tesco for religious discrimination because he was asked to handle crates of alcohol in a warehouse.'
2008/9/28,b'PETER HITCHENS: How China has created a new slave empire in Africa'
2008/9/28,b'German leader warns U.S. superpower era is over'
2008/9/28,b'How China has created a new slave empire in Africa'
2008/9/28,b'Americans deploy advanced radar system to Israel'
2008/9/28,"b'Report: Taliban, Afghans in secret peace talks'"
2008/9/28,"b'Russia has called for a revival of the global anti-terrorism coalition that formed after Sept. 11, 2001'"
2008/9/28,b'The Banker Suicides Have Begun'
2008/9/28,b'Austrian voters support party that wants to bring back Nazi symbols'
2008/9/28,b'Now Brits could be forced to apply for a visa before travelling to America'
2008/9/28,b'Top Afghan policewoman shot dead'
2008/9/28,"b'China\'s State News Agency Publishes Article Describing The Taikonauts First Night In Space Before They Had Even Left Earth And Blame It On A ""Technical Error""'"
2008/9/28,b'Official Story Of Pakistan Truck Bombing Is A Lie'
2008/9/28,"b'Blast in Delhi again, two killed'"
2008/9/28,b'Austrian Elections: The Populist and His Protg'
2008/9/28,b'Lawyers for China milk victims pressed to quit'
2008/9/28,"b'Sunni cleric Yusuf Qaradawi calls Shiites heretics trying to invade Sunni nations, tapping into anti-Iran anxieties. Shiites express dismay at the remarks amid Iraq war and efforts to forge unity.'"
2008/9/28,b'Violence Increases as Settlers Begin Challenging Israel'
2008/9/28,b'Revealed: secret Taliban peace bid'
2008/9/28,"b""China's Tainted-Milk Crisis Grows Despite Official Claims """
2008/9/28,b' Confusion looms over ownership of seized Ukrainian military cargo '
2008/9/28,b'Islamist plunder weapons from hijacked ship in Somalia'
2008/9/28,b'Chavez says crisis-hit U.S. needs new constitution'
2008/9/28,"b'Darren Meade, is Being the Change he Wants to See in the World.'"
2008/9/28,b'Credit crunch banker leaps to his death in front of express train'
2008/9/29,b'The Power Of Nightmares - BBC (Part 1)'
2008/9/29,"b""Japan makes cars. Saudi Arabia pumps oil. China supplies socks and flat-screen TVs. What's America's No.1 export? Debt"""
2008/9/29,b'Chinese officials called it a separatist attack; new photos show Chinese officers attacking other Chinese officers.. with machetes'
2008/9/29,"b""Huge European bank and iinsurance giant fails -- bailout of 11.2 billion euro ($16.4 billion) by 3 separate gov'ts"""
2008/9/29,b'111-year-old woman murdered after being accused of witchcraft. Belief in witchcraft is NOT just a harmless quirk.'
2008/9/29,b'British children as young as nine are being forced into marriage by their families'
2008/9/29,"b'nucking futs... Israeli settlers threaten to kill British film crew, curse Jesus  Video of an Israeli settler threatening a British film crew. '"
2008/9/29,b'Sniper shoots dead a prisoner INSIDE French jail before he could be quizzed by police over a murder'
2008/9/29,b'Al Qaeda -- the Database'
2008/9/29,b'Extreme right emerges as strong force in Austria'
2008/9/29,"b'""The Taliban have been engaged in secret talks about ending the conflict in Afghanistan in a wide-ranging \'peace process\' sponsored by Saudi Arabia and supported by Britain""'"
2008/9/29,b'Hurricane hits canada.'
2008/9/29,b'New Security Organization Will Try to Prevent Nuclear Theft'
2008/9/29,b'Olmert: Israel Needs to Leave West Bank'
2008/9/29,b'Chavez says Venezuela will develop nuclear power'
2008/9/29,"b'Post-Ramadan crowd greeted with bombs of the car, suicide variety'"
2008/9/29,b'Militias Assassinate Gay Iraqi Leaders'
2008/9/29,b' Japan transport minister quits over gaffes'
2008/9/29,b'Venezuela wants to work with Russia on nuclear energy: Chavez '
2008/9/29,b'Aspiring chef dies hours after making ultra-hot sauce for chilli-eating contest'
2008/9/29,b'American pressure on the Gulf-States to save Wall Street'
2008/9/29,b'Powerful earthquake reported north of New Zealand'
2008/9/29,b'LTTE has launched a nerve-gas attack against Sri-Lankan troops'
2008/9/29,b'China running out of IP addresses '
2008/9/29,b'EU bans food imports from China'
2008/9/30,b'Gorbachev forms new Russian party opposing Putin'
2008/9/30,"b""Ahmadinijad's willingness to accept Israel - why do we always here the other side of the story?"""
2008/9/30,"b""Olmert Says Israel Must Withdraw From 'Almost All' of Occupied Territories"""
2008/9/30,"b""Mexican Violence Forcing Families to Migrate: Extreme poverty isn't the only reason people are fleeing Mexico these days"""
2008/9/30,b'America Loses Its Dominant Economic Role'
2008/9/30,b'French Muslims Find Haven in Catholic Schools '
2008/9/30,"b""Meanwhile There's A War Going On... Remember Iraq?"""
2008/9/30,b'Scores die in India temple crush'
2008/9/30,"b""REAL Somalian pirate story, ship was not iranian, but ukranian, and was not carrying WMD's"""
2008/9/30,b'Venezuela to build nuclear technology with Russia '
2008/9/30,"b'Bus collides with milk tanker, 35 dead in Pakistan '"
2008/9/30,b'Moscow already has a Trophy Museum of the Georgian War'
2008/9/30,b'A stampede at a hill-top temple in western India killed more than 147 people and wounded 55 others who had gathered to celebrate the start of a religious holiday.'
2008/9/30,b'197 dead in temple stampede in India'
2008/9/30,b'ZIMBABWE: Farm animals bartered to stave off hunger'
