2008/6/8,b'Nim Chimpsky: The tragedy of the chimp who thought he was a boy (and proved that humans were not humane)'
2008/6/8,"b""Canada: Beware slippery slope' to censorship, hearing told """
2008/6/8,"b'EU Vice-President Luisa Morgantini and the Irish Nobel laureate, Mairead Corrigan, have been tear gased and injured by the IDF while attending the ""International Conference on Non-violent Resistance""'"
2008/6/8,"b""Israeli minister: Israel will attack Iran if it doesn't abandon its nuclear program"""
2008/6/8,"b'Albino Killings in Tanzania. At least 19 albinos, including several young children, have been killed in Tanzania in the past year. [video] '"
2008/6/8,"b'Chiapas: army occupies Zapatista communities in ""anti-drug"" ops'"
2008/6/8,"b'Polar bear swims 200 miles, is shot dead upon arrival'"
2008/6/8,"b'News is a contraband item in Pakistan now, and it is being sold on the black market,'"
2008/6/8,"b'Albinos, Long Shunned, Face Threat in Tanzania where witch doctors are now marketing albino skin, bones and hair as ingredients in potions that are promised to make people rich.'"
2008/6/8,b'Town in Britain Plans to Start its Own Currency'
2008/6/8,b'BBC reporter among 16 dead in Afghanistan'
2008/6/8,b'Lebanese women still vulnerable to violence: existing legal framework violates international human rights law because it fails to protect women from domestic violence'
2008/6/8,b'Police release chilling images of man left for dead by hit-and-run driver'
2008/6/8,"b""Iceland opens Europe's largest national park. The 15.000 square kilometer (5792 square mile) Vatnajkull National Park. """
2008/6/8,b'Citizens fighting Blackwater Potrero. Was the location chosen so they can train cheap Mexican soldiers or so they can perform extraordinary rendition from a partner facility in Mexico'
2008/6/8,"b""S. Korean protesters, police clash in beef rallies--don't want US beef..."""
2008/6/8,"b""Oil reserves 'will last decades' - a BBC Scotland investigation has been told"""
2008/6/8,b'Cameras designed to detect terrorist facial expressions'
2008/6/8,b'Israeli peace activists protest 41 years of occupation'
2008/6/8,"b""A 5.1 earthquake hits China's Southern Qinghai province."""
2008/6/8,"b'Man goes berzerk in Akihabara and stabs everyone nearby: 6 dead, 12 injured '"
2008/6/8,"b'Threat of world AIDS pandemic among heterosexuals is over, report admits'"
2008/6/8,b'Angst in Ankara: Turkey Steers into a Dangerous Identity Crisis'
2008/6/8,"b""UK: Identity cards 'could be used to spy on people' and a new children's database may be used to identify likely future criminals. Has covert surveillance gone too far?"""
2008/6/8,"b'Marriage, they said, was reduced to the status of a commercial transaction in which women could be discarded by husbands claiming to have discovered hidden defects in them.'"
2008/6/9,b'United States quits Human Rights Council'
2008/6/9,"b""Pentagon blocked Cheney's attack on Iran"""
2008/6/9,"b""'J Street,' a new liberal Jewish organization, hopes to challenge AIPAC's influence over U.S.-Israeli affairs"""
2008/6/9,"b'Former Ambassador Joseph Wilson: ""[The U.S. Military is] proselytizing not on behalf of the Constitution of the United States . . . but rather on behalf of some sort of fanatical view of end times""'"
2008/6/9,"b'EU leaders anxiously await Irish verdict on Lisbon Treaty. Ireland, the only country allowed a referendum will vote on June 12th. '"
2008/6/9,"b"" 17 Hit or Stabbed, 7 Confirmed Dead in Tokyo's Akihabara"""
2008/6/9,b'Treaty tensions mount as Iraq tells the US it wants all troops back in barracks'
2008/6/9,"b""Council paints over street artist Banksy's graffiti murals - worth a fortune!"""
2008/6/9,"b'""Finders keepers"" can get complicated when half a billion dollars and lawyers are involved'"
2008/6/9,"b'Chew Qat: In Yemen, 72 per cent of men and 32 per cent of women chew qat for two to six hours a day'"
2008/6/9,b'One of UKs most experienced and decorated special forces soldiers has quit the army after criticising the government for risking soldiers lives by failing to fund troops and equipment.'
2008/6/9,b'A bitter struggle between two powerful Beltway terrorism analysts has broken out as to whether Al Qaeda is still alive and well.'
2008/6/9,b'Jailers at Guantanamo urged to destroy interrogation notes: lawyer'
2008/6/9,"b'80% UK Laws Now Made In Brussels and the UK Parliament has no power to reject or amend them. Few voters realize how many powers have been, or are about to be, transferred elsewhere.'"
2008/6/9,b'Virgin Media UK working with record industry to spy on and threaten downloaders'
2008/6/9,b'35 Ukraine miners trapped underground - threat of rising water'
2008/6/9,b'Bilderberg attendee Geithner calls for global bank framework'
2008/6/9,"b'Jos Manuel Barroso bullies the Irish, saying that there will be a price to pay if Ireland rejects the Lisbon Treaty.'"
2008/6/9,"b""Don't worry everyone, AIDS is officially over!"""
2008/6/9,b'What if Bush Attacks Iran on His Way Out of Office?'
2008/6/9,b'Future of the United States of Europe in the Hands of Ireland '
2008/6/9,"b""'Military coup' in Zimbabwe as Mugabe is forced to cede power to generals """
2008/6/9,b'Rising Oil Prices Spark Strikes in Spain and a Saudi Call to Meet'
2008/6/9,"b'Chvez to FARC: Asks to end armed strugle, ""The guerrilla war is history"" and that ""time has come to free all of the hostages""'"
2008/6/9,b'Fliers in for pain as airlines pack it in'
2008/6/10,"b'Oil shortage a myth, says industry insider'"
2008/6/10,"b""Israel launches 'Iran Command' for war"""
2008/6/10,"b""Petition Calling for an Investigation into 9/11 was Read Into Record of Canada's Parliament Today"""
2008/6/10,b'Canadian HRC Tribunal forces pastor to publicly renounce his religious beleifs'
2008/6/10,b'US and EU threaten to freeze Iranian assets unless uranium enrichment program is halted'
2008/6/10,b'Thousands of UK homeowners face negative equity'
2008/6/10,b'31 year old beats 3 year old to death: worst case of abuse'
2008/6/10,"b'White House Saying Senate Doesn\'t Get to Vote About Permanent Iraq Bases because its a ""Treaty"" ... A Treaty with WHO - Iraq\'s U.S. Installed, Occupied, Puppet Regime?!'"
2008/6/10,b'Man escapes North Korea after 33 years'
2008/6/10,b'The 14-year-old Afghan suicide bomber'
2008/6/10,"b""Zimbabwe 'run by military junta'"""
2008/6/10,"b'Former British Prime Minister: Falsely Linking Iraq to 9/11 was ""Misinformation""... ""We do have something to fear - the total loss of privacy to an intrusive state with authoritarian tendencies""'"
2008/6/10,b'College Drinking and Heart Problems'
2008/6/10,b'What? Tens of Thousands Protest Sale of US Beef in S. Korea for Fear of Mad Cow Disease?'
2008/6/10,b'Bush: U.S. and EU must bond to press Iran on nukes'
2008/6/10,b'Shanghai Composite tumbles 7.7 percent '
2008/6/10,b'Olmert Hints That U.S. Attack On Iran Is Near'
2008/6/10,b'Is Israel planning on using nukes in its next war? '
2008/6/10,b'USS Liberty -- New Revelations in Attack on American Spy Ship'
2008/6/10,"b""World's first church unearthed in Jordan """
2008/6/10,b'Corruption in Ukraine allows epidemic to reach crisis point'
2008/6/10,b'Bush Discusses Iran Sanctions With EU Leaders'
2008/6/10,"b""Tibet and the Olympic `tradition'"""
2008/6/10,b'Saddam tribe leader murdered in Iraq'
2008/6/10,b'Law creates underclass of child criminals'
2008/6/11,b'BBC uncovers lost Iraq billions'
2008/6/11,b'War Criminal George W. Bush not Welcome in the U.K.'
2008/6/11,"b'Offensive Speech: US says it\'s ""free"", others disagree'"
2008/6/11,"b'Bush/Cheney Plan Demands 58 US Bases In Iraq, immunity from prosecution for U.S. troops and private military contractors, and will allow U.S. troops to remain in the country indefinitely.'"
2008/6/11,b'Grocery refuses to sell Jack Daniels barbecue sauce (2% alcohol) to 25-year-old without ID'
2008/6/11,b'On farewell tour of Europe: Bush steps up threats against Iran'
2008/6/11,"b""Pakistan Blames U.S. Coalition for Troops' Deaths"""
2008/6/11,"b'Senior intelligence officer leaves top secret terrorist files on train: If Al Qaeda truly were as dangerous as our lying leaders paint them, we would be so fucked...'"
2008/6/11,"b'Food for schoolchildren was ordered to be given to backers of President Robert Mugabe, the U.S. ambassador said.'"
2008/6/11,"b""Cuba's City Gardens Flourish and 70% Of Vegetables And Herbs Are Organic. """
2008/6/11,"b'The European Commission has pledged to support open standards and promote interoperability, to avoid vendor lock-in of European governments to any one technology'"
2008/6/11,"b""China's list of Olympic don'ts"""
2008/6/11,b'Blogging in Singapore: a hazardous business'
2008/6/11,b'Iraqis Denounces American Demands for 60 Military Bases'
2008/6/11,"b'Africa: World Leaders Begin Debate On Crop Use for Biofuels, Food'"
2008/6/11,b'Iran 1st in Middle East stem cell research'
2008/6/11,"b' Set a Guinness World Record, Enjoy a Better Web'"
2008/6/11,"b'France blocks online child porn, terrorism, racism'"
2008/6/11,"b'""Race for Life"" coming to Czech Republic'"
2008/6/11,"b""They're Killing Us Darling. They Really Are. Since the people running the show have been found to be lying, merciless psychopaths then there are no limits to the evil they will do."""
2008/6/11,b'OPEC Supports Saudi-Backed Oil Summit'
2008/6/11,b'A major and twelve Pakistani soldiers martyred'
2008/6/11,b'Turkish PM: court must explain headscarf ruling'
2008/6/11,b'crazy fitness tools from 1860  '
2008/6/11,b'2 US Lawmakers say computers compromised by Chinese '
2008/6/12,"b'Did US attack Pakistan last night? ""Pakistan fury at deadly US strike ""'"
2008/6/12,"b'If U.S. or Israel drops a bomb on Iran, it will shut down Gulf oil exports by launching a barrage of missiles on tankers in the Strait of Hormuz and Arab oil facilities'"
2008/6/12,"b""Top Secret documents on Al-Qaeda left on a train by a 'very senior intelligence official working in the Cabinet Office'.  Documents found by passer-by and handed to the BBC"""
2008/6/12,b'Seoul protest that started over allowing possible mad cow (Creutzfeldt-Jakob Disease) in beef threatens to topple government. (Why dont WE care?)'
2008/6/12,"b""'Jewish settler attack' on film """
2008/6/12,b'Cult of Scientology has disabled man from Plymouth arrested (Stuart Wyatt)'
2008/6/12,"b'No one knows the long-term carrying capacity of planet Earth for humans, absent cheap fossil fuels, but its likely a lot fewer than 7 billion. The implication is not just sobering; its paralyzing.'"
2008/6/12,"b'Robert Mugabe is stealing food aid from the hands of children, and giving it to political supporters. Does this guy have any semblance of humanity left?'"
2008/6/12,"b'Huh, the American establishment has a LONG history of being incredible dicks to enemy combatants (dating back to WW2)'"
2008/6/12,"b'Marine ""Mean Motari"" gets expelled, another punished over puppy throwing video'"
2008/6/12,b'American Aid Is Seized in Zimbabwe'
2008/6/12,b'US offers pledge of $10.6bn for Afghanistan'
2008/6/12,b'What a great country.'
2008/6/12,b'United Airlines to Charge for Checked Bags'
2008/6/12,"b""Zimbabwe's military is actively involved in running Robert Mugabe's re-election campaign."""
2008/6/12,"b'Chinese are naming children ""Olympic Games""'"
2008/6/12,b'Pentagon released video of a controversial air strike in Pakistan'
2008/6/12,"b'4 dead, 40 hurt as tornado hits Boy Scout camp'"
2008/6/12,"b""Islamic Cleric Issues Fatwa Condemning Gambian President's Gay Genocide"""
2008/6/12,b'Footage of deadly US airstrike'
2008/6/12,"b'British MP to resign, seek-relection in defence of civil liberties!'"
2008/6/12,"b""John McCain believes that it would be a good thing to have a long-term military presence in Iraq as long as casualties are down. Wouldn't that make us conquerors or occupiers?"""
2008/6/12,b'China &amp; Taiwan reopen talks'
2008/6/12,"b'Estonian parliament approves EU Lisbon Treaty, Still Waiting on Ireland'"
2008/6/12,b'Ukranian Women Strip in Protest'
2008/6/13,b'it only took two planned attacks in Germany to persuade a majority of the population to support a massive dismantling of civil rights'
2008/6/13,"b""UK MP Resigns to launch a one-man crusade against the Government's plan for suspected terrorists to be detained for 42 days without charge."""
2008/6/13,"b""German Papers Say 'Many Have Lost Faith in America' Because of Bush"""
2008/6/13,"b""'Jewish settler attack' on film. Footage from a video camera handed out by an Israeli human rights group appears to show Jewish settlers beating up Palestinians in the West Bank."""
2008/6/13,b'US Army fraudulently alters armor test results!'
2008/6/13,b'Zimbabwe is going to shit even more - Opposition leaders arrested.'
2008/6/13,b'Fallujah Babies Suffer Unprecedented Deformities'
2008/6/13,"b""A sign of things to come?  Spain's trucker strike cripples the nation."""
2008/6/13,b'Comparison of how many days you can be held without charge in seven different countries. Way to go UK!'
2008/6/13,"b""Mexico and Spain Presidents Reject Embargo Against Cuba and say in joint conference it hasn't worked"""
2008/6/13,b'Mugabe stripped of US degree'
2008/6/13,"b'Insurgent attack frees hundreds from Kandahar prison. 1,710 Taliban now roaming the streets of Kandahar City. '"
2008/6/13,b'Hundreds of Taliban militants escape from prison in Afghanistan'
2008/6/13,"b'While Bush Admin is insisting on Abstinence-only sex ed, Iran -  yep, the one with the so called Mullahs - has been distributing free condoms &amp; needles to fight AIDS for years now!'"
2008/6/13,b'..it is Mugabe who is finding it difficult to come to terms with the reality that he is no longer popular - this is why he is now threatening war.'
2008/6/13,"b'Textbooks at a private Islamic school in northern Virginia teach students that it is permissible for Muslims to kill adulterers and converts from Islam, according to a federal investigation '"
2008/6/13,"b""'If you want to help Iran, don't attack' - interview with the Iranian human rights lawyer Shirin Ebadi, who was the country's first female judge"""
2008/6/13,b'U.S. Media Blackout On Bilderberg 2008'
2008/6/13,b'Written on the Bodies of Children: The Reality of War (Caution - disturbing images)'
2008/6/13,"b'Drought in Ethiopia has caused food shortages, killed livestock and more than doubled the number of people needing urgent humanitarian aid to 5 million'"
2008/6/13,b'Lisbon Treaty (European Constituion) rejected in Ireland - Tallies indicate No victory in Lisbon vote'
2008/6/13,"b'Israeli settlers throw stones at Palestinian boy, then steal his donkey. Compassion Zionist style'"
2008/6/13,b'Gadhafi: Obama fears Israel will assassinate him like it did JFK'
2008/6/13,"b'""the nuclear powers including the United States, France and Britain - should prepare to use nuclear weapons [...] to prevent the acquisition of nuclear weapons by a non-nuclear state""'"
2008/6/13,"b""E.U.'s New Rules Forcing Changes By U.S. Firms and require companies to demonstrate that a chemical is safe before it enters commerce -- the opposite of policies in the United States"""
2008/6/14,"b'McCain Slams Supreme Court\'s Guantanamo Ruling, Calling It ""One of the Worst"" in History'"
2008/6/14,b'What women find erotic: Looking at a naked man walking on the beach is about as exciting as looking at landscapes. Women find naked women more arousing. '
2008/6/14,"b""Palestinians barred from Dead Sea beaches to 'appease Israeli settlers'"""
2008/6/14,b'A jury in Quebec has acquitted a man of first-degree murder in the deadly shooting of a Laval police officer who raided his home last year.'
2008/6/14,b'The Times makes 200 years of newspapers online available'
2008/6/14,b'Japanese are now required to have their waistlines measured and must be below 35 inches. What if this happened in America?'
2008/6/14,b'EU Dictators May Ram Through Lisbon Treaty Despite Irish Rejection'
2008/6/14,b'Tiny teenager from India is smallest girl in the world-1ft tall only!'
2008/6/14,"b'""We don\'t have a clue where he is or even may be, the Western analyst said. We have had NO credible intelligence on Osama bin Laden since 2001.""'"
2008/6/14,"b""German Papers Say 'Many Have Lost Faith in America' Because of Bush"""
2008/6/14,b'So Much for Improvement in Iraq: Militia Leader al-Sadr Calls For New Offensive Against US Forces'
2008/6/14,b'Ukrainian female students stripped off in protest over hot water'
2008/6/14,b'EU referendum: Czech president says Lisbon Treaty project is over'
2008/6/14,"b'In Canada, the government will take your children if you hold unpopular beliefs'"
2008/6/14,b'See for Yourself: Eyewitness Testimony from 9/11 [vid]'
2008/6/14,b'Mugabe vows the opposition will never lead Zimbabwe and threatens civil war. Meanwhile his rival for the presidency is rearrested. '
2008/6/14,"b""Prostitution - Unheard of During the Taliban's Rule - Is Now Common in Afghanistan"""
2008/6/14,b'340 Taliban militants escape after Kandahar prison is attacked with car bomb and rockets'
2008/6/14,b'Popularity of palm oil pushing orangutans towards extinction? Producers resist movement to force food manufacturers to list palm oil on product labels'
2008/6/14,b'EU leaders vow to press on with treaty after defeat'
2008/6/14,b'6.9 earthquake rattles Japan '
2008/6/14,b'Bill Presses Iraq to Recognize Israel'
2008/6/14,"b""President of Jewish National Fund's Florida zone arrested on prostitution charges in connection with a Craigslist sting"""
2008/6/14,"b""New Israeli homes are 'unlawful' - Palestinian leaders have criticised Israeli plans to build more than 1,000 new Jewish homes on occupied land in East Jerusalem. """
2008/6/14,b'European Lobbying Transparency Cyber Action'
2008/6/15,"b'How is impeachment a front page story in Le Monde, while barely being covered in the top tier main stream media of the US? A great Gore Vidal article with some excellent comments.'"
2008/6/15,"b'Get Osama Bin Laden before I leave office, orders George W Bush'"
2008/6/15,b'Bill Moyers Journal: The National Intelligence Agency is issuing a contract to spy on players of massive multiplayer online games like World of Warcraft and Second Life.'
2008/6/15,"b'In May, more US and allied troops were killed by guerrillas in Afghanistan than in Iraq'"
2008/6/15,b'Ireland Punishes the EU for Constitution Trick (They should add a Bill of Rights. That is what it took to get the US Constitution approved.)'
2008/6/15,"b'Congressman Nadler: ""Senior American officials ought to go to jail for this""'"
2008/6/15,b'Maliki calls U.S. demands unacceptable'
2008/6/15,b'Americas Prison For Terrorists Often Held The Wrong Men'
2008/6/15,b'Now they can lock you up indefinitely'
2008/6/15,b'Pair of reporters interview 66 former Guantanamo detainees'
2008/6/15,"b""Britain's military says soldiers can wear their uniforms in London's gay pride march"""
2008/6/15,"b'Nuclear Weapons Blueprint shared with the ""Axis of Evil"" by Pakistani Scientist. Is this Bush`s smoking gun? '"
2008/6/15,"b""Saudi Arabia's oil minister on Sunday will address reports that the world's largest oil-producing country is set to raise production by about 500,000 barrels per day."""
2008/6/15,b'2 US Professors speak in Israel: The pro-Israel lobby in the US is leading the charge for attacking Iran and damaging US interests.'
2008/6/15,"b""World's Most Expensive Real Estate Markets: #1 is London and #8 is Manhattan..."""
2008/6/15,"b'If Bin Laden is Still Alive and Still a Threat, and if Bush is All About Winning the ""War on Terror"", Why is Bush Only NOW Showing Re-Found Interest in Killing Him?'"
2008/6/15,b'Experts astounded at the high rate of imprisonment in New Zealand--almost twice that of most western European countries'
2008/6/15,b'President of Afghanistan threatened Sunday to send troops to Pakistan to fight Talibans for the prison operation that liberated hundreds of fighters'
2008/6/15,b'Covering the Beijing Games? Expect to be Censored'
2008/6/15,b'The Institute for the Investigation of Communist Crimes in Romania'
2008/6/15,b'Afghanistan threatens to invade Pakistan.'
2008/6/15,"b'Real people 1, Eurocrats 0 (after extra time)'"
2008/6/15,b'Drugs cartel led by woman turns Mexican town into shooting gallery'
2008/6/15,b'Bush urges British PM Brown not to set Iraq pullout timetable'
2008/6/15,b'Karzai Threatens to Send Forces Into Pakistan'
2008/6/16,b' Iran withdraws $75 billion from Europe'
2008/6/16,"b'Lithuania has rejected the idea of sending Germany an invoice for occupying the country during WW II. Instead, Lithuania is demanding cash from Russia for forcing it into the Soviet Union in 1940'"
2008/6/16,b'Israel pressed to reveal why army killed cameraman'
2008/6/16,"b'""People were understandably annoyed at being smashed over the head in their own country at the request of a foreign security service""'"
2008/6/16,b'Russia: Father identifies missing son in neo-Nazi beheading video'
2008/6/16,b'Guantanamo routinely held the wrong men.'
2008/6/16,b'What you dont see on CNN: IOF Shoot Live Ammunition on Peaceful Protest'
2008/6/16,b'Repressive governments are arresting record numbers of bloggers for speaking out online'
2008/6/16,b'Weird:  Bin Ladens son aspires to be peace activist'
2008/6/16,b'RED ALERT: Talibans on the offensive have taken control of eight villages and are marching toward Kandahar city.'
2008/6/16,"b""Blueprint for nuclear warhead found on smugglers' computers"""
2008/6/16,b'17 Reasons Why Bicycles Are the Most Popular Vehicle in the World Today'
2008/6/16,"b'We are very happy with the food crisis. Why? Because we produce a lot of food, and our problem has been the market. (WTF?)'"
2008/6/16,b'RFK Jr. warns Canadians about corporate media'
2008/6/16,"b'Protesters chant ""George Bush terrorist"" and ""Arrest George Bush"" as Bush dines with rupert Murdoch'"
2008/6/16,"b'Satellites Document War, Destruction From Outer Space'"
2008/6/16,b'Who leaked the details of a CIA-Mossad plot against Iran?'
2008/6/16,b' Iraq takes a turn towards Tehran'
2008/6/16,"b""Russia's 7 wonders announced"""
2008/6/16,b'Why Americans Are No Longer the Tallest People in the World'
2008/6/16,b'Man gunned down as he stomps a toddler to death'
2008/6/16,b'Want to understand the conflict in Central Asia?  Cute chibi countries can help!'
2008/6/16,b'Out of Panic Grows Muddled Thinking - the US Airlines Industry | from the hip'
2008/6/16,"b'Refugee forcibly deported from Australia to China is tortured, then commits suicide.'"
2008/6/16,b'Austrian cellar wife returns to dungeon '
2008/6/17,b'Poll:  World trusts Ahmadinejad more than Bush to do the right thing regarding world affairs.'
2008/6/17,"b'Egypt achieves truce between Israel and Hamas leaders, will go into effect within three days'"
2008/6/17,"b'New Amsterdam smoking ban doesnt apply to marijuana, you will be breaking the law if you smoke a tobacco-based joint '"
2008/6/17,b'Swedes take to the street to fight domestic spying'
2008/6/17,b'Guantnamo has proved a useful distraction from the secret detention camps run by the US around the world'
2008/6/17,b'London Police Attack Bush Protesters with Truncheons'
2008/6/17,b'Fifth severed foot found on Canadian coast'
2008/6/17,"b""Hamas Says It's Reached Cease-Fire Truce With Israel"""
2008/6/17,b'Undercover BBC reporter in Zimbabwe encounters feared Mugabe supporter'
2008/6/17,b'Report: U.S. Gave Green Light For Taliban Prison Attack'
2008/6/17,"b""West Bank 'attackers' arrested"""
2008/6/17,b'Vibrant London demonstration against George Bush attacked by police'
2008/6/17,b'Top 5 - Worlds Smallest Cars'
2008/6/17,b'So much for not talking to terrorists'
2008/6/17,b'Wind Power Blows into Peru and Brightens Future'
2008/6/17,b'Israel and Hamas agree to Gaza truce'
2008/6/17,"b""Shame on US: Refugees from Iraq, Afghanistan Make Up Half the World's Total Reports UN"""
2008/6/17,b'Ahmadinejad to OPEC: Dump weak dollar'
2008/6/17,b'Fifth severed foot found on the British Columbia shoreline!!'
2008/6/17,"b'A backlash is brewing against Beckham and his fellow band of famous Lakers fans, whose prime seats cost up to $20,000 each'"
2008/6/17,b'Time travel could be possible in months'
2008/6/17,b'Iran Attack More Likely as Bush Pretends to Use Diplomacy?'
2008/6/17,b'BREAKING: Car bomb kills more than 50 Iraqis in crowded marketplace'
2008/6/17,b'Iran Withdraws $75B from European Banks to Prevent Seizure'
2008/6/17,"b""Serbia rejects Kosovo's constitution"""
2008/6/18,b'Norway passes law approving gay marriage'
2008/6/18,"b'Saddam Hussein succesor surfaces, gives interview despite the $10 million U.S. bounty on his head and outlines the resistance strategy'"
2008/6/18,"b'Wikileaks Gets Hold of US Counterinsurgency Manual that advocates detainment without charge, suspension of habeas corpus, employing terrorists, and false flag operations '"
2008/6/18,b'When Trains are Faster than Airplanes'
2008/6/18,"b""Zimbabwe's voters told: choose Mugabe or you face a bullet"""
2008/6/18,b'Am I a Torturer? a soldier asks himself'
2008/6/18,"b'Guantanamo detainees were tortured, medical exams show'"
2008/6/18,"b'Way To Go, White House:  Gitmo Now a Terrorist Networking Spot'"
2008/6/18,"b'Muslim man insults prophet Muhammed, sentenced to death in Pakistan'"
2008/6/18,b'MEDICAL examinations of former terrorism suspects held at Abu Ghraib prison in Iraq and Guantanamo Bay found evidence of torture and other abuse that resulted in serious injuries and mental disorders'
2008/6/18,"b'Kuwait wants to outlaw Xboxes and ban Christmas, do away with the Arab world\'s version of ""American Idol,"" and keep female drivers off the roads. Then what, U.S. military bases too?'"
2008/6/18,b'Japan Times: Member of Japanese Parliament Takes 9/11 Doubts Global'
2008/6/18,"b'NYT Exposes Fraud of Bushs ""Generous Offer"" to Iran'"
2008/6/18,b'South Africa has ruled that Chinese South Africans are to be reclassified as black people'
