2008/7/21,b'9 Iranians set to be stoned to death'
2008/7/21,"b'Despite pressure from White House and an International court order, Texas will execute 5 Mexicans on schedule'"
2008/7/21,b'Japan Bans in Vitro Fertilization for Couples in Which Both Partners are Infected With HIV'
2008/7/21,"b'Benny Morris, writing in Friday\'s New York Times argues for Nuclear Genocide against Iran: Israel will eventually have to launch ""a preemptive nuclear strike.""'"
2008/7/21,b'Atheletes Who Offend China will be thrown out of the Olympics by the International Olympic Committee!'
2008/7/21,b'The world is failing to guard against the inevitable spread of a devastating flu pandemic which could kill 50 million people and wreak massive disruption around the globe'
2008/7/21,b'The Israeli army invades a charitable institution and a kindergarden in Jericho City'
2008/7/22,b'The picture that shames Italy'
2008/7/22,b'Karadzic Arrested! How come none of these links are in the top 10 on Reddit?!'
2008/7/22,"b""European Union says it won't support military action against Iran"""
2008/7/22,b'A 64-year-old London man who took photos of teenagers raising a ruckus in front of his apartment could be charged with assault. What is WRONG with the UK these days?'
2008/7/22,"b'Israel is trying to suppress a forthcoming ""scathing"" US report on its policies in the Palestinian territories.'"
2008/7/22,"b'If You Believe Attacking Iran Is A Good Idea, Listen To This!'"
2008/7/22,b'Chavez says Venezuela needs Russia for protection'
2008/7/22,b'Singapore Mulls Legal Kidney Trading '
2008/7/22,"b""Bosnian Serb wartime president Radovan Karadzic, one of the world's most wanted men for his part in civilian massacres, has been arrested."""
2008/7/22,"b'The minute I saw him turn over the first car, I knew it was a terror attack.'"
2008/7/22,"b'Mexican Resorts Destroying Mangroves, Dooming Fisheries'"
2008/7/22,b'Top war crimes suspect Karadzic arrested in Serbia'
2008/7/22,b'US general warns Russia on nuclear bombers in Cuba'
2008/7/22,"b""Canada's spreading cannabis crop"""
2008/7/22,"b'Thanks To U.S. And Russia, The End Of The World Inches Closer'"
2008/7/22,b'Blackwater to Shift Business Plan'
2008/7/22,"b'Karadzic, one of the most wanted men in the world, finally caught'"
2008/7/22,"b""Inflation 'to hit Asian growth'"""
2008/7/22,"b'Interesting British military document; Expects collapse of China, use of neutron bombs for ethnic cleansing, emergence of a small-super rich elite who will be able to afford life extention'"
2008/7/22,"b'Letters from Afghanistan - dogs, general, and orphans'"
2008/7/22,"b'Israeli filmed shooting prisoner, causing outrage--who is the hypocrite? (Video)'"
2008/7/22,"b""Hamdan: Guantanamo's Mystery Man"""
2008/7/22,b'UGANDA: Poverty driving child sex abuse in the north'
2008/7/22,b'Chinas Olympic security measures reveal a regime under siege'
2008/7/22,b'Nigerian Muslims hail meat which spells Allah'
2008/7/23,"b""That's one small step for a parliament, one giant leap towards dictatorship."""
2008/7/23,b'Russia to station nuclear bombers in Cuba?'
2008/7/23,b'Protester glues himself to British PM'
2008/7/23,"b'Hugo Chavez, the Venezuelan president, has called for a strategic relationship with Russia to counter aggression from the United States.'"
2008/7/23,b'Racist cop uses UK Terrorism Act to detain mixed-race family and take away their disabled child'
2008/7/23,"b'Zimbabweans Battle Money Shortages as Collectors Buy 100,000,000,000 Notes on eBay'"
2008/7/23,b'WTF Gas In Venezuela Is $0.12 per Gallon?! 97% Less Than USA - Worlds Highest And Lowest Gas Prices'
2008/7/23,"b""In solitary confinement in China, prisoner tells relatives he's so desperate for sunlight and human contact he'll go anywhere, including a forced labor camp"""
2008/7/23,"b'Angry at Bush, Russia considers closer Venezuela, Cuba ties'"
2008/7/23,"b'Cambodia standoff with Thailand continues, ""an imminent state of war, says Cambodia'"
2008/7/23,b'Samsung to Invest $1.63 Billion in Indonesian Biodiesel Project . Current rate of deforestation before the project: 380 US football fields an hour.'
2008/7/23,"b'Pakistans intelligence agencies and police have disappeared hundreds of Pakistanis, including children as young as 9.  '"
2008/7/23,b'British study links IMF loans to tuberculosis. IMF demands responsible for hundreds of thousands of deaths. '
2008/7/23,b'Magnitude 6.8 quake hits Japan'
2008/7/23,"b'UK: Official surveillance requests for details of telephone and internet records have surged to 1,400 a day'"
2008/7/23,b'Karadzic Backers Riot in Belgrade'
2008/7/23,b'UK: Water bills set to soar under compulsory meters. Average bills will rise up to 300 per cent.'
2008/7/23,b'French President Nicolas Sarkozy wins constitution battle by single vote '
2008/7/23,b'Secret life of fugitive Radovan Karadzic '
2008/7/23,b'Chavez Visit to Russia Intended to Send Message to US '
2008/7/23,b'Myanmar: How many of us have to die for your diplomatic game?'
2008/7/23,b'British Troops To Pull Out Of Iraq Next Year'
2008/7/23,"b""Sixteen year old girl told that she doesn't exist by UK [WTF] [BBC]"""
2008/7/23,"b'Navy Prosecutor In Gitmo Case says flight 93 ""shot down""'"
2008/7/23,b'USA arms war-torn Africa under the guise of humanitarian aid'
2008/7/24,b'Key Benazir Bhutto assassination witness shot dead'
2008/7/24,"b""Six of the UK's biggest net providers have agreed a plan with the music industry to tackle piracy online."""
2008/7/24,b'UK Police extinguish buring knifeman. With their own bodies...'
2008/7/24,b'Sarkozy government implements police state measures. These changes are designed to curb mass resistance and political opposition to him and his programs. '
2008/7/24,b'The International Olympic Committee has banned Iraq from competing in the Beijing Olympic Games'
2008/7/24,b'Iranian military convoy rocked by mystery explosion'
2008/7/24,b'WTF! The IOC bans Iraq from competing in the Beijing Games -- a major blow to seven Iraqi athletes'
2008/7/24,b'Navy official: 9/11 Flight 93 was shot down'
2008/7/24,b'Emo and goth to be made illegal in Russia'
2008/7/24,b'How is it not gay to rape someone and do them up the butt?'
2008/7/24,b'Turkish Man Believes His Ant Farms Can Predict Earthquakes'
2008/7/24,b'Parents lose custody of girl for naming her Talula Does the Hula From Hawaii'
2008/7/24,b'Iraq banned from Beijing Olympics because of government interference'
2008/7/24,b'Iran ends cooperation with UN nuclear arms probe '
2008/7/24,b' British study links IMF loans to tuberculosis'
2008/7/24,b'US soldiers charged with conspiracy to murder Iraqis'
2008/7/24,"b""China's mobile phone users top 600 million"""
2008/7/24,b'Canada Enraged After European Union Announces a Potential Ban on Imports of Seal Products'
2008/7/24,b'US War on Drugs FAIL - in Afghanistan'
2008/7/24,b'Long Term US Presence in Northern Iraq is Moving Forward'
2008/7/24,"b'FOIA request yeilds photos of U.S. ""prisoner boxes"" used in Iraq '"
2008/7/24,"b'Joke of the day - Iran introduces ""Islamic human rights day"" - oh wait, it\'s not a joke after all'"
2008/7/24,b'Two Italians rescued from Pakistani mountain'
2008/7/24,"b'oil market investigation, regulators bring lawsuit against dutch firm for ""19 separate attempts at market manipulation in March 2007""'"
2008/7/24,b'Myanmar: Religion cannot be separated from politics; what did the Buddha say about Political Involvement?'
2008/7/25,b'More UK insanity. An 82- year old woman was told she could not take pictures of an empty pool because she might be a pedophile. '
2008/7/25,"b'Iraqi sprinter after news of Olympic ban: ""In this horrible situation, who can say I\'ll even be alive in 2012?""'"
2008/7/25,"b'Lev Leviev, Israels richest man, buying blood diamonds, funding illegal Israeli settlements in the West Bank, undermining the prospects for Middle East peace'"
2008/7/25,b'Iran ends all cooperation with IAEA'
2008/7/25,"b""Vladimir Putin's comments drive a company's stock down $6 billion"""
2008/7/25,b'Hole forces Qantas plane to land'
2008/7/25,"b'As soon as Chinese officials noticed, they ordered the removal of the paper from the news-stands and part of its website was blocked.'"
2008/7/25,b'Oil Prices Bring Sailing Back: The first commercial cargo of French wine to be transported by sailboat in the modern era is due to arrive in Dublin this week'
2008/7/25,"b""Try the Kalashnikovs. they're delicious and come with a serving of grenade"""
2008/7/25,"b""At least seven low-intensity blasts tore through India's high-tech hub of Bangalore"""
2008/7/25,"b'Bangalore hit by serial blasts, at least 1 dead'"
2008/7/25,"b""UK: Limit families to two children 'to combat climate change'. Exactly who in the UK is having a lot of kids?"""
2008/7/25,b'China now has more web-surfers than U.S.'
2008/7/25,b'European nations planning to harvest the Sahara desert sun in Africa to provide clean electricity for the whole of Europe. There is no mention of how this will benefit Africa. '
2008/7/25,b'Fugitive spammer dies in murder-suicide'
2008/7/25,"b""Beijing's Air Pollution Index Rises Despite City's Efforts"""
2008/7/25,b'Russia considers banning Czech beer. The reason? Objections over Czech plans to host a United States radar station.'
2008/7/25,b'Russian Navy prioritizes construction of nuclear submarines'
2008/7/25,"b'""Kids in Congo were being sent down mines to die so that kids in Europe and America could kill imaginary aliens in their living rooms""'"
2008/7/25,"b""The people of Berlin experienced the full range of Barack Obama's charisma on Thursday evening."""
2008/7/25,b'Painter fined for smoking in van '
2008/7/25,"b'7 Bomb Blasts serially in Bangalore (Bengaluru), IT capital of India '"
2008/7/25,b'A 73-year-old Dutch man was astonished to learn from police that the begonias he had lovingly tended on his doorstep concealed a secret marijuana plantation.'
2008/7/25,b'Afghan government accused of shielding opium trade'
2008/7/25,"b""Russia 'may use Cuba to refuel nuclear bombers'"""
2008/7/26,"b""Sex slave: 'Every day we were raped'"""
2008/7/26,"b'Israeli writer calls B\'Tselem human rights group, who brought recent IDF shooting of bound and blindfolded Palestinian man to light, ""despicable...enemy collaborators""'"
2008/7/26,"b'After all those years of ""success"" as dictator of Zimbabwe, Mugabe may finally see his regime collapse because of the loss of a few software licenses and a paper contract.  '"
2008/7/26,"b'Uranium leaks into French river, tarnishing nuke power image'"
2008/7/26,"b'Iran announces nuclear expansion - Ahmadinejad has said Iran now possesses 6,000 centrifuges for enriching uranium'"
2008/7/26,b'Denmark : Nationalist party threatens to withdraw support from government if government cedes to EU demands on immigration'
2008/7/26,b'Mexicos leaders to allow its oil to be stolen. Go Neocons. Calderon insists that his reforms are necessary for the very survival of the country. So it doesnt end up like Iraq?'
2008/7/26,b'More bomb blasts in India - 3 explosions reported from Ahmedabad'
2008/7/26,"b'Indian City of Ahmedabad rocked by 17 Bomb Blasts within 70 minutes. 15 Dead, 100 Wounded.'"
2008/7/26,"b'Saudi schoolbooks teach piety, hate'"
2008/7/26,b'A plane was forced to make an emergency landing in Germany after two British women tried to open a cabin door mid-flight'
2008/7/26,b'Iran Moves to Expand Uranium Enrichment Program Against Western Pleading'
2008/7/26,b'Russian expert : 80% of Islamic literature in Russian offers wahabi ideas'
2008/7/26,"b'Britain told by UN, treat Muslims better'"
2008/7/26,"b'Iran to hang 30 for murder, other crimes'"
2008/7/26,b'Egypt: Muslim Brotherhood goes on-line on Facebook'
2008/7/26,"b""Obama's Private Prayer 'Leaked'"""
2008/7/26,b'Iraq banned from Olympics'
2008/7/26,"b'Shape up in two months or go, Gordon Brown warned '"
2008/7/26,b'Islam to become Russias predominant religion by 2050?'
2008/7/26,b'Olympics: Protesters will be kept in pens during games'
2008/7/26,"b""Iraqi's banned from the olympics because of the government, while China with its human rights record is occupying multiple countries"""
2008/7/26,"b'AP Analysis: U.S. Winning Iraq War. Iraq and its American partners are now winning the war that seemed lost two years ago, says AP Chief'"
2008/7/26,b' Fire causes mass evacuations from Greek resorts'
2008/7/26,"b' Bosnian Serbs pray for Karadzic, say charges unjust'"
2008/7/27,"b""[BREAKING] India on terror high alert: 14 blasts rock western city of Ahmedabad, while the country stills reels under yesterday's blasts in Bangalore"""
2008/7/27,b'This is Your Brain. This is Your Brain on Cell Phones: Dr. R Heberman -- director of Univ of Pittsburgh Cancer Institute -- sent memo warning staff on cell phone use.'
2008/7/27,b'BBC NEWS: Thirteen die in Istanbul blasts'
2008/7/27,"b'Iran hangs 29 drug traffickers, murderers, rapists'"
2008/7/27,b'A leading member of one of the most notorious clans of the Naples mafia has been arrested while shopping in Rome.'
2008/7/27,b'South Africa tells Robert Mugabe to surrender'
2008/7/27,"b"" Turkey's military said its fighter jets hit 12 Kurdish separatist targets in northern Iraq"""
2008/7/27,b'EU court overturns Irish ban on non-EU spouses'
2008/7/27,"b""A modest proposal for the ADL: We won't deny your holocaust if you won't deny this ongoing one."""
2008/7/27,b'Painter fined for smoking a cigarette in his own van'
2008/7/27,"b""'Mini-Katrina' needs attention - Cedar Rapids Iowa 7 weeks after the Flood"""
2008/7/27,b'Hearing on Limits of Executive Power: Robert Wexler'
2008/7/27,"b""A third of British Muslim students think religious killings are justified: Don't we have any more of those rusty Boeings, to take them where they would feel more at home?"""
2008/7/27,"b'""Feel the terror of Death,"" e-mail threatens minutes before a series of bombings kill at least 45 '"
2008/7/27,b'62% of Egyptian men regularly harass women'
2008/7/27,b'Hizbullah fans in Lebannon (SFW) [Pic] [Warning: Complicated &amp; Not-Black-&amp;-White polictiacl Understanding  Ahead]'
2008/7/27,"b'Istanbul bombs kill 13, at least 100 wounded'"
2008/7/27,b'Inmates sleep in toilets at overcrowded prison'
2008/7/27,"b""Palestinian 'Che' Blindfolded and Shot """
2008/7/27,b'Global Forces Converge To Drive Up Oil Prices'
2008/7/27,b'Hamas and Fatah clash in Gaza'
2008/7/27,b'Myanmar : DVB website attacked by pro-military hacker'
2008/7/27,b'Let Them Eat Free Markets -   How deregulation fuels the global food crisis.'
2008/7/27,b'India Arrests Dozens In Bombings That Killed 45'
2008/7/27,"b""India's president and prime minister have appealed for calm after a series of explosions killed at least 45 people in the western city of Ahmedabad"""
2008/7/28,b'New Swedish telecommunications law is turning the famously liberal country into a big brother state. Most Swedes hate it.'
2008/7/28,b'Life outside of civilization...'
2008/7/28,"b'Villagers in western India burned a Dow Chemical building site. Dow is synonymous with deaths of 3,800 people in the catastrophic industrial accident in Bhopal. It is still hated. '"
2008/7/28,b'All passengers flying from British airports with departure lounges used by both domestic and international travellers face being fingerprinted from next year.'
2008/7/28,"b'From January 2004 to March 2007, the death toll from terrorist attacks in India was 3,674, second only to that in Iraq during the same period.'"
2008/7/28,b'Brain Can Change Itself'
2008/7/28,b'Muslims attack Christian school in Indonesia'
2008/7/28,b'Suspected US missiles kill six in Pakistan'
2008/7/28,"b'Hacker Obtains NASA UFO Photos, Faces Prison'"
2008/7/28,"b""Britain's Fuel Costs: Who's Really to Blame?"""
2008/7/28,"b""Al-Qaeda chemical expert 'killed'"""
2008/7/28,"b""'Women' bombers kill 25 Shiite pilgrims in Baghdad"""
2008/7/28,b'Scientists may study sinister fault by drilling hole into it'
2008/7/28,b'Deadly blasts rock Istanbul - At least 16 people killed and more than 150 hurt as two bombs explode on busy shopping street.'
2008/7/28,"b'48 killed, 249 wounded in Iraq bombings'"
2008/7/28,b'BBC banned but pornography for sale in Olympic village'
2008/7/28,b'British Police Confirm Unusual Aircraft'
2008/7/28,"b""The Taliban's dazzlingly modern insurrection"""
2008/7/28,b'Rebels claim sabotage on Shell pipeline in Nigeria'
2008/7/28,b'Iraq profiles: Social worker'
2008/7/28,b'Fatah and Hamas conflict ready to burst open- Roadblock to reconciliation and negotiations with Israel.'
2008/7/28,b'The Government Did It'
2008/7/28,b'A yearn to kern: Fonts are the clothes that words wear'
2008/7/28,"b'The e-mail\'s subject line said ""Await 5 minutes for the revenge of Gujarat,"" '"
2008/7/28,b'US Warns Israel Against Staging A False-Flag Attack To Draw US Into War With Iran'
2008/7/29,b'Acid attacks are on the rise in India. Acid attacks are a form of gender violence; they are intended to silence women who stand up for themselves.'
2008/7/29,b'Farmers in third-world countries are being hauled into court - for breeding their own seeds.'
2008/7/29,b'Crocodile Cage of Death '
2008/7/29,"b'Monday: 87 Iraqis Killed, 288 Wounded '"
2008/7/29,"b""The world's biggest arms exporters - JUST five countries supplied 80% of global arms exports between 2003 and 2007,"""
2008/7/29,"b'Asian Bug Killing Ash Trees are now in Ottawa, Canada'"
2008/7/29,b' Iran tells developing states to fight world-power bias'
2008/7/29,b'UK: A Report Commissioned By Gordon Brown  Says Military Cadet Forces Should Be Set Up In Schools To Restore Discipline And Control Unruly Pupils '
2008/7/29,b'10 Ways to prevent Cyber Bullying'
2008/7/29,b'Iraqi athletes will head to Beijing after all'
2008/7/29,b'The War Between the United States and Iran is on by Scott Ritter'
2008/7/29,"b""Ex-Mossad chief says strike on Iran could 'affect us for 100 years'"""
2008/7/29,"b""Hijackers made off with boxes of blank British passports worth a fortune on the black market in a raid on a delivery van, police said, in the latest blow to the government's record on security."""
2008/7/29,b'How the illegal cigarette trade fed the Yugoslav wars'
2008/7/29,b'China continues to persecute those who speak out for human rights'
2008/7/29,b'Peace Movement Thwarts Iran Blockade'
2008/7/29,b'New report shows Palestinians being tortured in jail.'
2008/7/29,b'WTO talks collapse amid farm stand-off '
2008/7/29,b'Grim News From IMF: No End In Sights On Credit Crisis.'
2008/7/29,b'Report: China human rights have not improved'
2008/7/29,"b'Thus I was astonished to read, in a Reuters report on the bombing, reproduced yesterday in the Washington Post without comment or challenge, that The PKK usually does not target civilians.'"
2008/7/29,"b'Peruvian model faces a criminal investigation after posing nude on a horse, using Perus national flag as a saddle'"
2008/7/29,b'Malaysia : Four transvestites arrested in raid on beauty pageant appeal one-week jail sentence'
2008/7/29,b'Pakistan : Death threat for editor Najam Sethi over Islamic cartoon'
2008/7/29,"b'Abu Khabab al-Masri, Al Qaeda ""Master of Terror,"" Killed... Maybe'"
2008/7/30,b'Palestinians capture violence of Israeli occupation on video '
2008/7/30,"b'One million innocent Britons ""criminalized,"" '"
2008/7/30,b'UK : To beat extremism we must dissolve religious groups'
2008/7/30,"b'Palestinian boy, 10, dies as Israeli troops fire on demonstrators - victim was shot through the forehead'"
2008/7/30,"b""Baikal:  The gun of choice for Britain's gangland """
2008/7/30,b'Israeli troops kill young child in West Bank barrier demonstration'
2008/7/30,"b""Innocents' DNA 'should be erased'"""
2008/7/30,"b""Saudi Arabia: Academic gets 600 lashes for 'phone relationship' with female pupil"""
2008/7/30,b'Iran: Her heroin addict husband beat her and forced her into prostitution. The man who murdered her husband served 8 years in prison and is now free. But she is about to be stoned to death. '
2008/7/30,b'Microsoft Prepares for End of Windows With Midori '
2008/7/30,"b'UK: 3,000 Blank Passports and Visas Stolen from Security Van'"
2008/7/30,b'Knoxville Tragedy Redeemed By Heroism'
2008/7/30,"b'Israel as a Strategic Threat to Russia and the U.S. Israel is thought to have more nukes than Britain, China, India and Pakistan, and probably more than France. '"
2008/7/30,b'Starting August 9th George Orwells diaries will be posted online daily in blog form. What will we see in the Orwell diaries?'
2008/7/30,b'Karadzic Turned Over to UN War Crimes Tribunal'
2008/7/30,"b'Mohawk community looks for answers weekend of violence in Quebec, Canada'"
2008/7/30,b'The Internet Is Shit.'
2008/7/30,b'Emirates Airlines received the first Airbus A380  '
2008/7/30,b'Zimbabwe to introduce new currency in order to combat hyperinflation'
2008/7/30,b'Protestors put on mouth gags in a demonstration against censorship during Olympic Games [pic]'
2008/7/30,b'IDF kills young Palestinian boy. Potentially NSFW.'
2008/7/30,b'Poles (heh) upset about bordering German nude beach'
2008/7/30,b'Malaysia : Call to teach journalism students proper reporting of Islam'
2008/7/30,b'China Using Olympics As Pretext For Crackdown: Amnesty'
2008/7/30,b'Iran: Sixteen Christian converts arrested'
2008/7/31,"b""The International Olympic Committee agreed to website censorship. Critics decry Olympic committee's 'spineless' move of caving into the Olympic Games' authoritarian hosts."""
2008/7/31,"b""How Saudi Arabia's Prince Bandar muscled Tony Blair into silence."""
2008/7/31,"b'Son of Hamas leader converts to Christianity, denounces Islam'"
2008/7/31,b' Reuters seeks evidence on why cameraman held in Iraq'
2008/7/31,b'Pentagon Attempted To Cover-Up KBRs Negligence In Electrocution Of U.S. Soldier'
2008/7/31,"b'Mexico, like Switzerland, is fast becoming one of the recommended destinations for so-called death tourists'"
2008/7/31,b'Body of ballooning priest found at sea'
2008/7/31,b'Bush Administration Demands Japan Shoulder War Costs'
2008/7/31,b'China accuses US of trying to sabotage Olympics'
2008/7/31,b'UK: CCTV Cameras installed in cinemas.. watching you watching'
2008/7/31,b'Korean TV Leaks the Olympics opening ceremony to YouTube (VIDEO)'
2008/7/31,"b""Radovan Karadzic tells UN court 'US tried to kill me' """
2008/7/31,b'Beer Tourism'
2008/7/31,b'One year of labor for posting photos. No charge. No trial. No appeals.'
2008/7/31,"b'Unidentified disease with Ebola like symptoms kills 3, Chinese officials say ""there was some influenza""'"
2008/7/31,"b""British girl's remains found in suitcase in Brazil"""
2008/7/31,"b""Israel's Olmert to Step Aside Amid Corruption Probes"""
2008/7/31,b'Man Decapitated on Greyhound bus'
2008/7/31,"b""China lashes out at U.S. for 'politicizing Beijing Olympics'"""
2008/7/31,b'World leaders trade blame as WTO talks fail'
2008/7/31,"b'Love, blackmail and rape  how al-Qaeda grooms women as perfect weapons'"
2008/7/31,b'An online hoax becomes a source about Karadzic'
2008/7/31,"b'Robert Jensen: ""Universal Patterns within Cultural Diversity - Patriarchy Makes Men Crazy and Stupid""'"
2008/7/31,b'China to Limit Web Access During Olympic Games'
2008/7/31,b'5 Most Famous Cases of Gender Issues at the Olympics'
2008/8/1,b'CIA recorded Pakistani intelligence officers helping to plan the bombing of the Indian embassy in Kabul (54 dead).'
2008/8/1,"b""Today's Honour Killing:  Man kills slutty sister in Jordan, may face 6 months in Jail.  Examination reveals she was  a virgin."""
2008/8/1,b'India Vindicated by CIA Pakistan Charge'
2008/8/1,"b'WTF Russia?!  ""\'If we had no sexual harassment we would have no children,\' the judge ruled.""'"
2008/8/1,b'Persian (Farsi) is waaaay easier than languages like Arabic. Consider learning it instead if interested in working in Middle East intelligence gathering / foreign affairs'
2008/8/1,b'Israeli Military Shoots 10 Year Old in the Head (includes graphic image)'
2008/8/1,b'There are 1.7 million rapes a year in South Africa. 75% are gang rapes.'
2008/8/1,b'China drops heavy Internet censorship  at least for now'
2008/8/1,"b""Man Who Assisted in Burning Girlfriend's Ex-Lover Wins Appeal"""
2008/8/1,b'A dozen academic instutions from around the world are now working frantically to save and evaluate the crumbling documents in Timbuktu'
2008/8/1,b'A Guide to the Shadowy Organizations That Rule the World'
2008/8/1,b'Afghanistan: Not a Good War'
2008/8/1,b'Chinese woman jailed 18 months in US espionage case'
2008/8/1,"b""CIA fucks India with Pakistan's dick and blames Taliban"""
2008/8/1,"b""British girl's Brazilian lover murdered her, went to a party afterwards, then took pictures as he decapitated her and chopped up her body"""
2008/8/1,"b'Friends identify man stabbed, beheaded on Greyhound bus'"
2008/8/1,"b'9,000 Couples to Marry on Lucky 8/8/08'"
2008/8/1,b' Mofaz says Iran heading toward nuclear breakthrough'
2008/8/1,b'Beijing Olympic Organizing Committee Bans Professional Camera Equipment For Non-Press Visitors'
2008/8/1,b'Explosion at Turkish School Dormitory Kills 17 Girls'
2008/8/1,"b'Since Sunday, more than 40 illegal immigrants from countries like Morocco, Algeria, Rwanda and the Congo have been climbing cranes around the city'"
2008/8/1,"b""World's heaviest man goes on diet"""
2008/8/1,"b'Pakistanis Aided Attack in Kabul, U.S. Officials Say'"
2008/8/1,b'Reports on the finer points of a rectal examination.. make other sex scandals that once shocked people here - such as Monica Lewinsky and her blue dress - seem almost Victorian.'
2008/8/1,b'Pakistan denies spies behind Indian embassy attack '
2008/8/2,b'Covert CIA Detention Center on British Soil Revealed'
2008/8/2,"b""U.S. Protects War Criminals: Karadzic was protected by the United States until a CIA phone bug caught him breaking the terms of his 'deal.'"""
2008/8/2,"b'""Muslims can\'t say it, but it\'s clear they don\'t accept us. Here no one can speak the truth on this issue, so everybody\'s feelings are kept inside.""'"
