2008/11/13,"b""Local council spends $150,000 of taxpayers' cash....in bid to save taxpayers' cash """
2008/11/13,"b'Vetting blunders label 12,000 innocent Britons as paedophiles, violent thugs and thieves'"
2008/11/13,b'Russian leader Medvedev heading to Cuba &amp; Venezuela '
2008/11/13,b'Junk mail levels drop by 70% all because of the closure of one web hosting company'
2008/11/13,b'Egypt halts doctor visas to Saudi'
2008/11/13,b' Martin Kettle: Tabloid irresponsibility means readers get most of their political information from newspapers no one trusts | Comment is free | The Guardian '
2008/11/13,b'EU unveils plan to weaken Russian grip on gas supply'
2008/11/14,"b'Putin: ""I am going to hang Saakashvili by the balls. Why not? The Americans hanged Saddam Hussein."" Sarkozy: ""Yes, but do you want to end up like Bush?"" Putin: ""You have a point""'"
2008/11/14,"b'Jewish Settlers throw rocks at palestinians, IDF tries to force human rights worker recording the events to turn his camera off'"
2008/11/14,"b""Surprise surprise, now clueless UK politicians think they can regulate the internet through 'league tables' and 'age identity cards'"""
2008/11/14,"b""Woman reaches US army's top rank"""
2008/11/14,b'Child protection register failed to communicate more than 80% of the abuse cases!'
2008/11/14,b'Russia Set To Change Constitution To Allow Vladimir Putin To Become President Again'
2008/11/14,b'Israel for blocking entry of journalists into Gaza'
2008/11/14,b'Did Michelangelo Have a Hidden Agenda?'
2008/11/14,"b""Must Read If You Haven't Already: 'The Israel Lobby' By Professors Mearsheimer and Walt"""
2008/11/14,b'Vandals blew up a statue of Lenin in Ryazan'
2008/11/14,b'Taliban urge world to block Afghan executions'
2008/11/14,"b'British Couple Divorce Over Second Life: ""I looked at the computer screen and could see his character having sex with a female character. It\'s cheating as far as I\'m concerned""'"
2008/11/14,b'Must Watch Documentary: The Israel Lobby and US Foreign Policy'
2008/11/14,"b'Egyptian doctor sentenced to fifteen years jail, 1,500 lashes in Saudi Arabia'"
2008/11/14,b'U.N Reports Accuse Israel of Human Rights Abuses Against Palestinians'
2008/11/14,b'Ron Paul on the up and coming G20 Summit'
2008/11/14,b'Curly Cukes to be Decriminalised'
2008/11/14,b'Canada Alert: Rumour has it that a massive computer fraud has hit the PC Bank'
2008/11/14,"b'Britain passes out pedometers to battle obesity and create nine ""healthy"" towns.'"
2008/11/14,b'Hong Kong finds melamine in fish feed from mainland China'
2008/11/14,b'Sri Lanka Seizes Tamil Stronghold '
2008/11/14,b'Croat government bans Christmas'
2008/11/14,"b'Up to 50 nuclear warheads are believed to have gone missing during the Cold War, and not all of them are in unpopulated areas.'"
2008/11/14,"b'UN closes Gaza aid centers, citing lack of food'"
2008/11/14,b'Car Bombing in Iraq Kills at Least 7 '
2008/11/15,b'Israel prevents 15 truckloads of medicine from entering Gaza'
2008/11/15,b'Wikipedia blocked in Germany by leftwinged gay politician Lutz Heilmann. '
2008/11/15,"b'Policeman Beats and Kills Unarmed Man in Custody, is Convicted of Manslaughter and Given One Year Prison'"
2008/11/15,b'Chronic malnutrition in Gaza blamed on Israel'
2008/11/15,"b""Where tax goes up to 60 per cent, and everybody's happy paying it! In Sweden high rates underpin a very successful society"""
2008/11/15,"b""Isolated Paraguayan Tribe Wins Wins Lawsuit They Didn't File"""
2008/11/15,b'Hiroshima: The Lost Photographs'
2008/11/15,"b'Gordon Brown wants to turn all British citizens into organ donors, willy nilly, unless they individually opt out. WTF!'"
2008/11/15,b'World Leaders Agree to Act Together on Financial Crisis'
2008/11/15,b'Powerful 7.5 quake recorded in Indonesia'
2008/11/15,b'Less than 20% of Brits trust newspapers'
2008/11/15,b'Russian spy in Nato could have passed on missile defence and cyber-war secrets'
2008/11/15,b'Albino Africans Live In Fear Of Cannibal Witch Doctors'
2008/11/15,"b""The Earth's 6th Great Mass Extinction is Occurring as You Read This"""
2008/11/15,b'Japanese ship seized by Somali pirates'
2008/11/15,b'Somali pirates hijacked Japanese cargo ship'
2008/11/15,"b""It's five minutes to midnight."""
2008/11/15,"b'UK awash in donated Aussie sperm: Come again, Aussie backpackers told'"
2008/11/15,b'U.N. Agency in Gaza Runs Out of Food'
2008/11/15,"b'Seventh foot, shod in a New Balance trainer, washes up as mystery deepen'"
2008/11/15,b'Limerick rival clans show no sign of ending conflict'
2008/11/15,"b""A bitter harvest - The West Bank's olive harvest is in full swing, and so are the settlers' clubs and the soldiers' batons"""
2008/11/15,b'EU-Russia Summit: Brussels and Moscow Rediscover Friendship'
2008/11/15,b'How Hindu extremists in India killed two birds with one stone'
2008/11/15,"b""Tony Blair's Iraq adviser wins 50,000 U.S. defence job"""
2008/11/16,"b""Pirates hijack Saudi 'super tanker'"""
2008/11/16,b'German intelligence scrubs European records after Wikileaks exposure'
2008/11/16,"b'Zoo cleaner commits suicide by feeding himself to three white tigers... Wow, what a way to go...'"
2008/11/16,b'Anti-Scientology book pulled in UK'
2008/11/16,b'UK Officials Plan To Grow Genetically-Modified Crops In Top Secret Military Locations In Order To Thwart Angry Anti-GM Extremists.'
2008/11/16,"b""UK society 'condemning' children"""
2008/11/16,"b""How Bush's grandfather helped Hitler's rise to power"""
2008/11/16,b'It Looks As If Putin is Carrying Out a Constitutional Junta.'
2008/11/16,b'McClellan: George W. Bush Outed CIA Agent Valerie Plame watch! '
2008/11/16,"b'Former senior law lord, Lord Bingham, says Britain broke international law by invading Iraq'"
2008/11/16,b'Ethnic riot erupts in Czech town'
2008/11/16,"b""Japan, the world's second-largest economy, tumbles into recession"""
2008/11/16,"b'No Wonder They Want To Bomb Iran: The government is now reportedly holding gold as its reserves, as versus one fiat currency or another.'"
2008/11/16,b'Chavez Spies on Rivals In Election - plays tapped conversation in TV comercial'
2008/11/16,"b""Russia may use 'overkill' missiles to counter U.S. shield"""
2008/11/16,b'Japan firm recalls US water - Smelled like medicine or pesticide'
2008/11/16,b'Suspected ETA commando leader arrested in France'
2008/11/16,"b""Donor 'opt-out' proposal rejected"""
2008/11/16,"b""India's Richest Lost $200 BILLION"""
2008/11/16,b'Iran navy tightens grip on Persian Gulf'
2008/11/16,"b'Archaeoastronomy dynamically counts down the days, hours and minutes until equinoxes, solstices and cross quarters'"
2008/11/16,"b""[Australia] Alleged burglar critical after citizen's arrest (resident reportedly sat on him)"""
2008/11/16,b'Japan firm recalls 8 million bottles of U.S. mineral water '
2008/11/16,b'Suspected ETA military chief arrested in France'
2008/11/16,"b'The current economic rescue plan, in a comic [PIC]'"
2008/11/17,b'Haitians are so desperate for food that many mothers wait to name their newborns because so many infants die of malnourishment'
2008/11/17,b'Israeli Tanks Storm Into Gaza Strip'
2008/11/17,"b'Hillary Clinton will be the next Secretary of State. In Westchester/NYC, Bill is saying ""Sweet! Yeah! Off to foreign lands! Have fun!"" In Albany, Paterson is saying ""This is my ticket out!""'"
2008/11/17,b'China says no to sending troops to Afghanistan'
2008/11/17,b'Australian navy given two months off for Christmas'
2008/11/17,b'Afghan article says US Bin-Ladin hunt phoney '
2008/11/17,b'60 Journos Arrested at Sudan censorship rally'
2008/11/17,b'Congo - a picture that changed a life'
2008/11/17,b'ETA chief arrested in southern France '
2008/11/17,b'Tibetan Exiles Meet to Ponder Strategy'
2008/11/17,"b'Child refugees make up 60% of the 250,000 fleeing in Congo - Pictures'"
2008/11/17,"b""Iraq invasion 'serious violation of international law'"""
2008/11/17,b'CNNs Michael Ware on Iraq withdrawal agreement: Tehran was in the room.'
2008/11/17,b'Russia to build nuclear reactor for Venezuela'
2008/11/17,b'Somali Pirates Holding 14 Ships With 250+ Men Hostage'
2008/11/17,b'Hijacked oil tanker nears Somalia '
2008/11/17,b'British airline pilots threaten strike over ID card plan'
2008/11/17,b'Former MIT Student now a Terrorism Suspect is Not Mentally Competent and Unfit for Trial.'
2008/11/17,b'Iranian grain ship seized as Somali pirates hold world to ransom'
2008/11/17,b'Single Sex Schools to Make a Comeback...How Realistic Is the Thought?'
2008/11/17,b'BBC: Seized tanker anchors off Somalia'
2008/11/17,b'Stage set for Indo-Russia nuke pact '
2008/11/17,b'Israel supports direct talks with Iran.  Says global financial crisis should delay war with Iran.'
2008/11/17,b'Obama Meets With McCain in Chicago '
2008/11/17,b'The Japanese comic version of Das Kapital joins a collection of increasingly fierce literary critiques of the global capitalist system.'
2008/11/18,b'India sinks Somali pirate ship'
2008/11/18,"b'New prostitution laws in the UK mean men who pay to have sex with trafficked women may face rape charges, and ignorance is no defense.'"
2008/11/18,"b'Finally someone steps up to Somali pirates: INDIA sinks pirate ""mother ship""'"
2008/11/18,"b'Israel boycotts UN racism conference, claims bias'"
2008/11/18,"b""Egypt and Israel were at war. Anwar Sadat, Egypt's President, flew to Jerusalem to make peace. His plane door opened. Israel stood still. Israeli buglers sounded the salute. An unforgettable moment."""
2008/11/18,"b'After a mere four years, Ireland plans to reinstate a ban on handguns.'"
2008/11/18,"b'With no money, Pakistan moms abandon kids'"
2008/11/18,b'Somali pirates transform villages into boomtowns - building sprawling stone McMansions'
2008/11/18,b'British and American military secrets may have been passed to the Russians by a double agent -- biggest spy scandal since CIA traitor Aldrich Ames'
2008/11/18,b'Israel slams UN call to end blockade'
2008/11/18,"b""Forget Red vs. Blue -- It's the Educated vs. People Easily Fooled by Propaganda"""
2008/11/18,"b'The Government of Israel continues to act recklessly, and with utter disregard for the human rights of the Palestinian people, including their right to life and safety.'"
2008/11/18,b'A 26-year-old flight student is dead after a propeller accident'
2008/11/18,b'The British National Party (BNP) membership list which has been published online by an ex-member can be found here'
2008/11/18,b'IRAQ WAR ENDS'
2008/11/18,b'UN Calls For End To Israeli Blockade Of Gaza Strip'
2008/11/18,b'IAEA: Bombed Syrian site had features like a nuclear reactor'
2008/11/18,"b'""Today we have around 1.8 million (reported) cases of Police Torture Each Year in India. Those Tortured are generally the (Low-Caste) Dalits, the Tribals and the Muslims.'"
2008/11/18,"b'Well, well.  Blackwater wants to fight pirates now.  How unexpected.'"
2008/11/18,b'early thaw in the coming cold war?  Moscow reaches out to Obama on missiles'
2008/11/18,"b'Pirates strike again, seize Hong Kong grain ship bound for Iran'"
2008/11/18,b'More challenges to secret copyright treaty'
2008/11/18,b'WTF? Barack Obama Faces Charges in Memphis '
2008/11/18,"b""spy called 'The Spaniard' may have betrayed British and U.S. secrets to Russia for more than a decade"""
2008/11/18,b'UK government unveils plan for sex trade crackdown'
2008/11/19,b'Bush ignored by the other world leaders at the G20 meeting'
2008/11/19,"b'Israel Bans International Media from Gaza, Arrests Human Rights Activists'"
2008/11/19,"b'Somali Pirates: We dont consider ourselves sea bandits, he said. We consider sea bandits those who illegally fish in our seas and dump waste in our seas and carry weapons in our seas.""'"
2008/11/19,"b'Teenage Indian boy was thrashed, paraded through the streets with his head shaved and then thrown under a train for daring to write a love letter to a girl from a different caste. '"
2008/11/19,b'Russia to build nuclear reactor for Chvez'
2008/11/19,b'The $23 Million Ceiling at UN European headquarters in Geneva'
2008/11/19,"b'Man, the Dutch have it good [PIC]'"
2008/11/19,b'IMF finally approves $2.1B loan to Iceland'
2008/11/19,b'Afghanistan drug production up 150% since 2001'
2008/11/19,b'Hebrew papers told of Arab plan'
2008/11/19,b'India praised for sinking pirates'
2008/11/19,"b""Under Iraq Troop Pact , US Can't Leave Any Forces (Military or Civilian Contractors) Behind"""
2008/11/19,b'Crisis in paradise: Meltdown leaves ghost resorts.'
2008/11/19,"b""U.S. Missile Strikes beyond Pakistan's Tribal Belt"""
2008/11/19,"b""Experts say the Smithsonian's Hope Diamond once belonged to Louis XIV and was looted during the French Revolution."""
2008/11/19,b'S Africa to cut aid to Zimbabwe'
2008/11/19,b'Easyjet puts chokehold on windpipe op'
2008/11/19,b'Syria Claims Israel Planted Uranium (UN Listens)'
2008/11/19,b'Tokyo War Crimes indictment against George W. Bush'
2008/11/19,b'International Space Station celebrates decade in space'
2008/11/19,"b""Hungry in Zimbabwe: 'If you rest, you starve'"""
2008/11/19,"b""The World's Most Powerful Eating Strategies"""
2008/11/19,b'UN agrees DR Congo troop increase'
2008/11/19,b'Oil price drops below $50 a barrel'
2008/11/19,b'Man banned from all churches in England and Wales'
2008/11/20,b'Denmark considers outlawing male circumcision on minors.'
2008/11/20,"b'Russian scholar: ""Our people are much more nationalistic, much more chauvanistic, and anti-democratic than Putin himself, so the current regime is by no means the worst that we could have."" (AUDIO)'"
2008/11/20,b'Family makes 200K a year and gives most of it away'
2008/11/20,b'Week End Picnic: Families Slaughtered by Israel on Gaza Beach'
2008/11/20,"b'Children are dying in Haiti, victims of food crisis'"
2008/11/20,"b""Radio host shocked as woman admits eating 'little black girls'"""
2008/11/20,b'The U.S. Department of Energys National Renewable Energy Laboratory (NREL) and Petrleo Brasileiro S.A. (Petrobras) to Commercialize Biofuels'
2008/11/20,"b""More Than 1/3 of China's Land is Being Scoured by Erosion! Food Supplies at Risk!"""
2008/11/20,"b""What's the most generous nation in humanitarian donations in relation to GNP?  Surprise! It's Saudi Arabia.  US and England don't even hit the top 5."""
2008/11/20,b' Russian parliament approves extension of presidential term'
2008/11/20,b'Al-Jazeera editorial wonders why Western diplomats are such slow learners'
2008/11/20,"b'Russian Duma passes reform to extend presidency to 6 years. Welcome back, Comrade Putin?'"
2008/11/20,b'Germany Drops Attempt to Ban Scientology'
2008/11/20,b' French Socialists in run-off vote'
2008/11/20,b'Poland: Picketing hospital workers call for turning hospitals into cooperatives instead of traditional privatization'
2008/11/20,b'Russia set to extend presidential term'
2008/11/20,"b""US global dominance 'set to wane'"""
2008/11/20,b'UN should suspend Israel membership: Nobel Laureate Maguire'
2008/11/20,b'World struggles to take on plague of Somali piracy'
2008/11/20,"b""Slump in stockmarkets wipes out two-thirds of China's billionaires"""
2008/11/20,b'Cholera outbreak strikes Zimbabwe'
2008/11/20,b'What is the value of 500 Rs for different people in India or rather the World'
2008/11/20,b'billionaires body stolen'
2008/11/20,b'How the Allied multinationals supplied Nazi Germany throughout World War II'
2008/11/20,b'ATTN: RIAA/MPAA: This is piracy.'
2008/11/21,b'Swiss Army bans vegetarians from fighting '
2008/11/21,b'Kofi Annan and Jimmy Carter barred from visiting Zimbabwe to assess the humanitarian crisis'
2008/11/21,"b'Former police chief in Argentina, wanted for alleged crimes against human rights, has shot himself dead on live TV.'"
2008/11/21,"b'Progressive, tolerant Malaysia issues a fatwa...on yoga'"
2008/11/21,"b'1,000 penalties for out-of-date ID details'"
2008/11/21,"b'Icelanders demand PM resignation, clash with police'"
2008/11/21,b'In this year so far 24 missile attacks have taken place killing 344 civilians. The number of so-called militants does not exceed ten.'
2008/11/21,"b'Daryl Hannah Helps Stop Japanese Whaling By Joining The Sea Shepherd, The Ship Stopped $70M In Whaling By Japanese Last Year'"
2008/11/21,b'Situation in Pakistan more dire than Afghanistan: expert'
2008/11/21,b'Mugabe tries to hide cholera death toll'
2008/11/21,"b'Perth Mint (AU) is overloaded with demand for gold, suspends taking orders until JAN 09'"
2008/11/21,"b'Refusal to declare Lisbon dead \'treason\', ""It is a simple question: will you respect the Irish vote?""'"
2008/11/21,b'Soldiers in Iraq and Afghanistan to get anti-sniper device that can pinpoint the position of the shooter within a fraction of a second'
2008/11/21,b' Iran executes man in Israeli spy case'
2008/11/21,b'Michael Jackson Converted To Islam'
2008/11/21,"b""China stole files related to NASA's Mars Reconnaissance Orbiter that detailed the space vehicle's propulsion system, solar panels, and fuel tanks"""
2008/11/21,"b""Australia's Sex Party takes on 'nanny state'"""
2008/11/21,b'Paraguay reports 2nd cross-border raid by Brazilian troops'
2008/11/21,b'Is Mexico Finally Cleaning Up Corruption? Mexico Arrests Ex-Chief of Antidrug Agency '
2008/11/21,b'Britain colder than Moscow as blizzards sweep in from the Arctic'
2008/11/21,"b""Afghanistan's struggle to tap wind energy"""
2008/11/21,b' Iran hangs Iranian convicted of spying for Israel'
2008/11/21,"b'HIV/AIDS spreading fast in Russia despite more funding to fight it, AIDS coordinator says'"
2008/11/21,b'The God Delusion = Judas Priest = D&amp;D'
2008/11/21,"b'A former police chief in Argentina, wanted for alleged crimes against human rights, has shot himself dead in front of television cameras. (video)  '"
2008/11/22,b'Government Protests Turn Nasty in Iceland'
2008/11/22,"b'Swiss to UBS bosses: ""give us our money back, or we\'ll feed you to the crocodiles."" '"
2008/11/22,"b""TED: Debunking third-world myths with the best stats you've ever seen"""
2008/11/22,b'Warships from all Russian Navy fleets to fight piracy off Somalia'
2008/11/22,b'Presidents of Georgia and Poland fired upon in Georgia - facts very unclear...'
2008/11/22,"b'Smoking ban final nail in the coffin to French cafes ... the French are starting to ""eat like Americans"".  How sad.'"
2008/11/22,"b""Dozens injured as army open fire at Children's Day rally"""
2008/11/22,b'52 whales die in mass stranding in Australia.'
2008/11/22,b'Germans held in Kosovo over blast'
2008/11/22,b'Islamist fighters warn pirates to free Saudi tanker'
2008/11/22,b'Plitvice Lakes in Croatia | amazing pics'
2008/11/22,b'Argentine man kills himself on live TV'
2008/11/22,"b""Spain's fascists hold rally"""
2008/11/22,b'Beheadings in Guatemala jail riot'
2008/11/22,b'Avast Ye Privateers'
2008/11/22,"b""Jaguar in secret plea for 1bn gov't loan just months after being bought by Tata, the Indian conglomerate"""
2008/11/22,"b""'This may be the most thought-provoking film I've seen all year,' Israeli animated documentary about the Sabra and Shatila massacre of 1982"""
2008/11/22,b'Ministers to hold summit on church closure crisis'
2008/11/22,b'Pro-American Iraqi Defense Minister Threatens Parliament: Defense minister tells country: Keep U.S. Forces or Face Martial Law'
2008/11/22,b'Migration (hijra) in Islam - the plan of conquering the west through immigration'
2008/11/22,b'U.S. Army Investing $50 Million in Video Games'
2008/11/22,"b""Jabotinsky's grandson joins Likud"""
2008/11/22,b'Chavez tested in Venezuelan polls'
2008/11/22,"b""Obama's Mideast peace platform is coming into focus """
2008/11/22,b' Olmert in U.S. to bid farewell to Bush '
2008/11/23,"b""Jacques Vergs, 83, is probably the world's most notorious criminal attorney"""
2008/11/23,"b'China fails at irony, bans ""Chinese Democracy""'"
2008/11/23,"b'Japan turns to the left, especially the young, and the communist party grows as more people realize todays injustices mirror those of Imperial/Capitalist Japan.  '"
2008/11/23,b'Russian analyst predicts decline and breakup of U.S.'
2008/11/23,"b'We are not the moral people we pretend to be, not as long as we allow the Israelis to commit these war crimes.'"
2008/11/23,"b""Don't mess with these chicks or you'll be sari"""
2008/11/23,"b'British police to be issued 10,000 Taser guns - What happened to these being a weapon of last resort used by specalist officers?'"
2008/11/23,"b""Pink Sari Gang: India's Bad Ass Vigilante Group"""
2008/11/23,"b'""Despite being declared the largest labour rights offender in the world, Colombia has signed a free trade deal with Canada.""'"
2008/11/23,"b'Bullying is not a joke, no seriously..'"
2008/11/23,"b""Taser plan suffers blow after UK Met Police Authority's rejection"""
2008/11/23,b'Just killed an old man and put his wife in a critical condition? Time for McDonalds! '
2008/11/23,"b""A list of 25 pretty good date ideas that don't even cost a Quarter ... """
2008/11/23,"b""Tony Blair's private life spied on by US intelligence agency"""
2008/11/23,b'The last feudal state in the Western world is soon to become a democracy'
2008/11/23,"b""Who was behind the theft of South Africa's weapons-grade nuclear material?"""
2008/11/23,b'Photo Essay: Gazas (Literal) Underground Economy'
2008/11/23,"b'""They didn\'t accept HIV-positive people ... they shot them and burned the bodies""'"
2008/11/23,"b'Police to get 10,000 Taser guns -- Because More Tasers for Authority equals More Freedom and Safety for Us, i guess.'"
2008/11/23,"b""Georgian officials: shots fired at president's motorcade"""
2008/11/23,b'Recession has hit UK middle classes so hard that many are forced to pull their children out of private schools'
2008/11/23,b'Dubai bowed to international pressure and for the first time revealed the level of debt it has racked up during one of the biggest building sprees the world has ever seen'
2008/11/23,b'Crisis forces Russians to cut back vodka drinking'
2008/11/23,b'Wicked flood has thousands homeless in Brazil'
2008/11/23,b'Police examine culpability of those who encouaged internet suicide'
2008/11/24,"b'London Police boycott tasers ""because of their potential to cause fear and damage public confidence""'"
2008/11/24,"b'Reddit upvoted the original story, why not this one? Muslims arrest those involved in acid attack against schoolgirls in afghanistan'"
2008/11/24,b'Greenlanders go to the polls in referendum on self-rule'
2008/11/24,"b""Sunken 'pirate ship' was actually Thai trawler, owner says """
2008/11/24,"b'Seventy-two percent of the Israeli public rated the general level of corruption in the Israeli government as ""high to very high""'"
2008/11/24,b'The freedom of historical debate is under attack by the memory police'
2008/11/24,"b'US intelligence kept a file of personal nature on Tony Blair while he was Prime Minister, in violation of an agreement between Britain and the US not to spy on each others leaders'"
2008/11/24,"b""Food Bank in Seattle, Washington. C'mon Reddit--Let's Donate In Brenden Foster's name."""
2008/11/24,"b""Hey, Arab lady, you don't like it that we destroyed your homes?  Here's a headbut for you, and one for your Arab friend, too!  Now you're all under arrest."""
2008/11/24,b'10 Taliban arrested in acid attack on schoolgirls'
2008/11/24,"b'UN General Assembly President Accuses Israel of Apartheid and Calls for a Campaign of Boycott, Divestment and Sanctions Against Israel'"
2008/11/24,b'First pics of Indian navy sinking pirate ship'
2008/11/24,b'The end of the cafe/bar culture?'
2008/11/24,"b""Somali Pirate 'Mothership' sinking a mistake? """
2008/11/24,b'Russia sues Ukraine over gas debt'
2008/11/24,"b'""Between September and October property prices have plummeted by as much as 49% in some parts of Dubai""'"
2008/11/24,"b""The Czech Republic's Vaclav Klaus is next in the rotation as president of the European Union, a fact that makes some in the Union very nervous."""
2008/11/24,b'Blast kills 3 outside Russia subway station'
2008/11/24,"b""Oops, Sunken 'pirate ship' was actually Thai trawler, owner says """
2008/11/24,b'Russian warships cruise into US back yard to make power point'
2008/11/24,b'Wal-Mart to Give 90 Million lbs Food to Help Combat Hunger '
2008/11/24,"b'Zimbabwe Health Crisis ""A Disaster of Unimaginable Proportions""'"
2008/11/24,b'Nobody every seems to give a shit about the Congo'
2008/11/24,b'Kim Jong-Il Apparently Healthy.'
2008/11/24,b'Zimbabwe on brink of collapse as outbreak of cholera spreads'
2008/11/25,"b'RIP Brenden Foster, the 11-year-old whose last wish was to feed the homeless.'"
2008/11/25,b'Georgian ambassador admits that they started it.'
2008/11/25,b'How Canada honours our war dead sends shivers down my spine... seeing it in person is beyond breathtaking'
2008/11/25,"b'Turns out Indian Navy actually sank Thai fishing boat, not pirate mothership. Embarassing...'"
2008/11/25,"b'Mumbai under attack. Bomb blast and firefights in South Mumbai. Blasts and gun flights in Oberoi, Taj and Trident Hotels. A lot of Chaos, nothing is clear at the moment. '"
2008/11/25,"b'South Africa President Mbekis denial of the well-established scientific consensus about the viral cause of AIDS and the essential role of antiretroviral drugs led to the death of 365,000 people'"
2008/11/25,"b'""Pirate Boat"" Indian Navy Sank Was Thai Trawler.'"
2008/11/25,b'Mumbai rocked by deadly shootings '
2008/11/25,b'Evidence Suggests British Liquid Bomb Plot was Directed by UK/Pakistan/US Intelligence '
2008/11/25,b'Greenland votes for self-rule'
2008/11/25,"b""Divers Find Ammunition on Lusitania,  so much for 'innocent passanger ship'."""
2008/11/25,b'Quixtar and Amway are scams - Spread the word.'
2008/11/25,"b""Following in China's footsteps, US baby formula manufacturers add melamine!"""
2008/11/25,b'Mumbai attacked by terrorists'
2008/11/25,"b' 3,000 dead from cholera in Zimbabwe, Local Government takes action to conceal the scale of this deadly epidemic'"
